concern_id,source,vaccine_type,class,statement
357,gpt-4-0613,mmr,VaxConcerns_2.3,the immunity offered by vaccines will not be as strong or long-lasting as the immunity developed after contracting and fighting off the disease myself
358,gpt-4-0613,mmr,VaxConcerns_2.3,a push for the MMR vacine neglects the benefits of establishing natural immunity against such diseases
359,gpt-4-0613,mmr,VaxConcerns_2.3,"natural immunity - getting the disease and recovering - gives you better protection than any vaccine, even for diseases like measles, mumps, and rubella"
360,gpt-4-0613,mmr,VaxConcerns_2.3,"if I get the MMR vaccine, my body won't build a natural immune response against these diseases"
361,gpt-4-0613,mmr,VaxConcerns_2.3,"per some people I know, it's better to let your immune system fight off diseases like measles, mumps, and rubella naturally than to take a vaccine and potentially skip a step in the body's natural defenses"
362,gpt-4-0613,mmr,VaxConcerns_2.3,catching a disease and letting my body battle it is the most beneficial for my immune system in the long run
363,gpt-4-0613,mmr,VaxConcerns_2.3,getting a disease and building a natural immunity is a more valuable immune-boosting process than getting an MMR vaccine
364,gpt-4-0613,mmr,VaxConcerns_2.3,vaccines like the MMR may hinder my body's ability to naturally ward off the diseases themselves
365,gpt-4-0613,mmr,VaxConcerns_2.3,"natural immunity derived from actually contracting diseases like measles, mumps, and rubella could be more beneficial for my body in the long run, compared to artificially induced vaccine immunity"
366,gpt-4-0613,influenza,VaxConcerns_2.3,contracting the flu naturally would be more beneficial in the long run compared to getting a flu vaccine
367,gpt-4-0613,influenza,VaxConcerns_2.3,the influenza vaccines may not offer the same level of immune response as a natural infection would
368,gpt-4-0613,influenza,VaxConcerns_2.3,it's strange how people trust the vaccine's induced protection more than the body's robust natural immunity
369,gpt-4-0613,influenza,VaxConcerns_2.3,the immunity gained from actually getting the flu could be stronger and longer-lasting than what a vaccine can provide
370,gpt-4-0613,influenza,VaxConcerns_2.3,the natural immunity that comes from catching the flu might be more long-lived compared to the immunity offered by vaccines
371,gpt-4-0613,influenza,VaxConcerns_2.3,"the superiority of vaccines is doubtful when natural exposure to the flu can lead to solid, lifelong immunity"
372,gpt-4-0613,influenza,VaxConcerns_2.3,it's beneficial for our immune system to fight off diseases like influenza naturally rather than resorting to vaccines
373,gpt-4-0613,influenza,VaxConcerns_2.3,the flu vaccine can provide the immune response as comprehensive as the one generated by the natural disease
374,gpt-4-0613,influenza,VaxConcerns_2.3,the immunity from an influenza vaccine might not be as effective or durable as the immunity gained from a natural flu infection
375,gpt-4-0613,influenza,VaxConcerns_2.3,our bodies are better equipped to develop immunity naturally through infection than with the help of a vaccine
376,gpt-4-0613,yellow_fever,VaxConcerns_2.3,my body won't be able to properly fight off other diseases if I get the Yellow Fever vaccine instead of just naturally getting the immunity
377,gpt-4-0613,yellow_fever,VaxConcerns_2.3,facing the Yellow Fever virus in its natural form would be more beneficial for my body's overall resilience rather than using the vaccine
378,gpt-4-0613,yellow_fever,VaxConcerns_2.3,it seems like getting the virus naturally might offer longer lasting immunity
379,gpt-4-0613,yellow_fever,VaxConcerns_2.3,"allowing my body to naturally tackle and build immunity against the Yellow Fever virus may be just as effective, if not more so, than the vaccine"
380,gpt-4-0613,yellow_fever,VaxConcerns_2.3,"it's worrying how vaccines, like the one for Yellow Fever, might not give as sturdy and lasting immunity as the one Nature provides"
381,gpt-4-0613,yellow_fever,VaxConcerns_2.3,they are not convinced that it provides the same robustness that a naturally-acquired immunity can provide
382,gpt-4-0613,yellow_fever,VaxConcerns_2.3,the Yellow Fever vaccine won't provide as strong an immune response as if my body confronted and defeated the virus naturally
383,gpt-4-0613,yellow_fever,VaxConcerns_2.3,facing diseases head-on can build a more comprehensive immune response than vaccinations like the one for Yellow Fever
384,gpt-4-0613,yellow_fever,VaxConcerns_2.3,relying on the Yellow Fever vaccine might negatively impact the building of natural immunity in my body
385,gpt-4-0613,yellow_fever,VaxConcerns_2.3,empowering our bodies to naturally deal with viruses like Yellow Fever could be a better option for a large number of people rather than depending on vaccines
386,gpt-4-0613,unspecified,VaxConcerns_2.4,"the flu virus is not as dangerous as they make it out to be, so getting a flu shot annually seems unnecessary"
387,gpt-4-0613,unspecified,VaxConcerns_2.4,vaccines are pushed onto us even for diseases which are hardly ever seen these days
388,gpt-4-0613,unspecified,VaxConcerns_2.4,our bodies are strong enough to fight off these diseases without vaccines because they're not as deadly as they appear
389,gpt-4-0613,unspecified,VaxConcerns_2.4,for diseases such as measles are needed we rarely see outbreaks of said diseases anymore
390,gpt-4-0613,unspecified,VaxConcerns_2.4,"the potential side effects of the HPV vaccine may outweigh the benefits, considering the low rates of cervical cancer in my region"
391,gpt-4-0613,unspecified,VaxConcerns_2.4,the utility of receiving a hepatitis B vaccine when my lifestyle choices keep me from being exposed to such risks
392,gpt-4-0613,unspecified,VaxConcerns_2.4,"if vaccines for something as common as the chickenpox are necessary, given that it's typically a mild disease"
393,gpt-4-0613,unspecified,VaxConcerns_2.4,the risk of complications from vaccines might be higher than the risk of catching the disease it was developed to prevent
394,gpt-4-0613,unspecified,VaxConcerns_2.4,the push for a COVID-19 vaccine because I believe that the overall threat posed by the virus has been exaggerated
395,gpt-4-0613,unspecified,VaxConcerns_2.4,getting vaccinated for mumps seems redundant when we hardly hear about any cases in the modern day
396,gpt-4-0613,covid19,VaxConcerns_2.4,"the COVID-19 virus isn't as dangerous as it's made out to be, so what's the point of getting vaccinated"
397,gpt-4-0613,covid19,VaxConcerns_2.4,"the risks of COVID-19 are greatly exaggerated, do we really need a vaccine?"
398,gpt-4-0613,covid19,VaxConcerns_2.4,we've become too panic-stricken over a disease that doesn't seem to pose such a big threat
399,gpt-4-0613,covid19,VaxConcerns_2.4,"we are prioritizing vaccination over building natural immunity, which I reckon is much more durable against an illness that's not as hazardous as portrayed"
400,gpt-4-0613,covid19,VaxConcerns_2.4,the necessity of a vaccine for a virus that mostly only affects specific population groups.
401,gpt-4-0613,covid19,VaxConcerns_2.4,"vaccination is a hasty response to a virus that's not as life-threatening as others, isn't it more meaningful to focus on diseases with a high mortality rate like cancer?"
402,gpt-4-0613,covid19,VaxConcerns_2.4,we're blowing the dangers of COVID-19 out of proportion
403,gpt-4-0613,covid19,VaxConcerns_2.4,"the value of a COVID-19 vaccine is questionable when, from what I gather, the majority of people only experience mild symptoms"
404,gpt-4-0613,covid19,VaxConcerns_2.4,the emphasis on vaccinating everyone diverts attention from bigger health issues. Would it be better to concentrate on diseases considered more dangerous?
405,gpt-4-0613,covid19,VaxConcerns_2.4,wasting resources on a fictitious danger when there doesn't seem to be a substantial risk posed by COVID-19
406,gpt-4-0613,hpv,VaxConcerns_2.4,the HPV vaccination is unnecessary because the virus is not as dangerous as health experts claim
407,gpt-4-0613,hpv,VaxConcerns_2.4,the risks involved with the HPV vaccine outweigh the benefits because the virus isn't common
408,gpt-4-0613,hpv,VaxConcerns_2.4,"the health officials are overly exaggerating the risks of the Human Papillomavirus, making the vaccine seem more necessary than it truly is"
409,gpt-4-0613,hpv,VaxConcerns_2.4,"whether the HPV vaccine is truly beneficial, given the rarity and minimal danger of the virus it aims to prevent"
410,gpt-4-0613,hpv,VaxConcerns_2.4,if getting the HPV vaccine is worth it because the chances of contracting the virus are so low
411,gpt-4-0613,hpv,VaxConcerns_2.4,the media has blown the dangers of HPV out of proportion which adds unnecessary fear and compulsion towards the vaccine
412,gpt-4-0613,hpv,VaxConcerns_2.4,the potential risks and side-effects outweigh the benefits for a virus that isn't that common
413,gpt-4-0613,hpv,VaxConcerns_2.4,"the risk of contracting HPV is exaggerated, hence I question the benefits of receiving the vaccine"
414,gpt-4-0613,hpv,VaxConcerns_2.4,the danger of HPV is amplified to push the public towards getting vaccinated
415,gpt-4-0613,hpv,VaxConcerns_2.4,"the HPV vaccination campaign is using scare tactics to emphasize its importance, whereas the virus itself isn't as harmful or widespread as portrayed"
416,gpt-4-0613,mmr,VaxConcerns_2.4,"measles, mumps, and rubella cases are so rare nowadays, the MMR vaccine seems unnecessary"
417,gpt-4-0613,mmr,VaxConcerns_2.4,my child might go through the discomfort of getting the MMR shot for diseases that are hardly seen anymore
418,gpt-4-0613,mmr,VaxConcerns_2.4,the risk related to the MMR diseases are exaggerated to boost vaccine sales
419,gpt-4-0613,mmr,VaxConcerns_2.4,if MMR vaccines are important anymore given the decline in prevalence of these diseases
420,gpt-4-0613,mmr,VaxConcerns_2.4,whether the hype about the MMR vaccine is more about pharmaceutical profits than actual dangers from these diseases
421,gpt-4-0613,mmr,VaxConcerns_2.4,"the lessened prevalence of measles, mumps, and rubella indicates no real need for the MMR vaccination"
422,gpt-4-0613,mmr,VaxConcerns_2.4,"the threat of contracting measles, mumps and rubella is overstated to enforce MMR vaccination"
423,gpt-4-0613,mmr,VaxConcerns_2.4,"the potential hazards from measles, mumps, and rubella circulate to spur fear and promote vaccinations"
424,gpt-4-0613,mmr,VaxConcerns_2.4,"acquiring measles, mumps, or rubella is a significant risk in this age, despite encouragement for the MMR vaccine"
425,gpt-4-0613,mmr,VaxConcerns_2.4,the benefits of MMR vaccination given that these diseases no longer pose the same threat they once did
426,gpt-4-0613,influenza,VaxConcerns_2.4,"the flu is not really as dangerous as health organizations make it out to be, so why take the flu shot annually?"
427,gpt-4-0613,influenza,VaxConcerns_2.4,the threat of influenza is greatly magnified by doctors and Big Pharma to sell more vaccines
428,gpt-4-0613,influenza,VaxConcerns_2.4,we are overhyping the danger of the flu to justify unnecessary vaccinations
429,gpt-4-0613,influenza,VaxConcerns_2.4,"whether we really need flu jabs every year, doesn't our body's immunity kick in at some point"
430,gpt-4-0613,influenza,VaxConcerns_2.4,"the public is being misled about the actual risks of influenza, thus creating a culture of unnecessary vaccination"
431,gpt-4-0613,influenza,VaxConcerns_2.4,it's reckless to insist on vaccinating against a virus that's not even as common or epidemic
432,gpt-4-0613,influenza,VaxConcerns_2.4,"most people get vaccinated out of fear, not true knowledge of the disease's impact"
433,gpt-4-0613,influenza,VaxConcerns_2.4,the health risks presented by the flu virus are exaggerated to increase vaccine use
434,gpt-4-0613,influenza,VaxConcerns_2.4,flu is generally not severe enough to warrant an annual vaccine for everyone
435,gpt-4-0613,influenza,VaxConcerns_2.4,the influenza virus isn't as life-threatening as they make it out to be
436,gpt-4-0613,yellow_fever,VaxConcerns_2.4,"Yellow Fever is a rare disease, so I don't see why I need to vaccinate"
437,gpt-4-0613,yellow_fever,VaxConcerns_2.4,"Yellow Fever exists, but I don't think it's common enough in my area to warrant vaccination"
438,gpt-4-0613,yellow_fever,VaxConcerns_2.4,"they have read that the risk of contracting Yellow Fever is very low, so is the vaccine truly necessary?"
439,gpt-4-0613,yellow_fever,VaxConcerns_2.4,"people might be exaggerating the prevalence of Yellow Fever, I have never met anyone who got it"
440,gpt-4-0613,yellow_fever,VaxConcerns_2.4,"the potential side effects of the Yellow Fever vaccine might outweigh the benefits, considering the insignificant risk"
441,gpt-4-0613,yellow_fever,VaxConcerns_2.4,the medical community needs to focus on more common diseases instead of scaring people with unlikely threats like Yellow Fever
442,gpt-4-0613,yellow_fever,VaxConcerns_2.4,global health organisations might be overblowing the Yellow Fever risk to justify vaccine production
443,gpt-4-0613,yellow_fever,VaxConcerns_2.4,"the actual risk of getting Yellow Fever is quite minimal, so is it really worth me getting the vaccine?"
444,gpt-4-0613,yellow_fever,VaxConcerns_2.4,"Yellow Fever is a significant threat to my health, so I'm questioning the necessity of the vaccine"
445,gpt-4-0613,yellow_fever,VaxConcerns_2.4,"there's a lot of fearmongering about rare diseases like Yellow Fever, which leads to unnecessary vaccination"
446,gpt-4-0613,unspecified,VaxConcerns_2.5,natural immunity is far more effective and long-lasting than what vaccines offer
447,gpt-4-0613,unspecified,VaxConcerns_2.5,"maintaining a healthy lifestyle and nutritious diet could naturally strengthen our immune system, removing the need for vaccines"
448,gpt-4-0613,unspecified,VaxConcerns_2.5,"we are overlooking traditional herbal medicines which have managed to prevent diseases for generations, in favor of vaccination"
449,gpt-4-0613,unspecified,VaxConcerns_2.5,the overreliance on vaccines might overshadow breakthroughs in therapeutic medicines that can cure diseases without side effects
450,gpt-4-0613,unspecified,VaxConcerns_2.5,f homeopathy could be a safer and more gentle alternative to vaccinations that often come with adverse reactions
451,gpt-4-0613,unspecified,VaxConcerns_2.5,"the body's own immune system, if properly nurtured, can fend off any infections better than vaccines can"
452,gpt-4-0613,unspecified,VaxConcerns_2.5,the advancements in stem cell therapies might make them a viable alternative to vaccinations in the near future
453,gpt-4-0613,unspecified,VaxConcerns_2.5,our quick jump to vaccines might miss out on potential alternatives such as the benefits of herd immunity
454,gpt-4-0613,unspecified,VaxConcerns_2.5,the belief that reliance on mask-wearing and social distancing would save us from the potential risks associated with vaccines
455,gpt-4-0613,unspecified,VaxConcerns_2.5,natural treatments such as acupuncture and Ayurveda can be effective in disease prevention and might eliminate the need for vaccinations
456,gpt-4-0613,covid19,VaxConcerns_2.5,"we are too focused on the COVID-19 vaccine, while simply increasing our hygiene practices, like frequent hand washing, could be equally effective"
457,gpt-4-0613,covid19,VaxConcerns_2.5,"there are herbal remedies that have been used for centuries to build our immune system, which could offer a better protection against COVID-19 than the vaccine"
458,gpt-4-0613,covid19,VaxConcerns_2.5,we should explore more about the effectiveness of hydroxychloroquine as an alternative to the COVID-19 vaccine
459,gpt-4-0613,covid19,VaxConcerns_2.5,"the medical community may be disregarding the benefits of natural immunity against COVID-19, which could be achieved without vaccines"
460,gpt-4-0613,covid19,VaxConcerns_2.5,the use of respirators and personal protective gear could be a safer alternative to getting vaccinated against COVID-19
461,gpt-4-0613,covid19,VaxConcerns_2.5,"with the power of healthy diets and exercise in boosting immunity, I feel the COVID-19 vaccine might not be as essential as portrayed"
462,gpt-4-0613,covid19,VaxConcerns_2.5,"the idea that the use of certain vitamins, like Vitamin C and D, can help our bodies fight against COVID-19 more naturally"
463,gpt-4-0613,covid19,VaxConcerns_2.5,"the rush to produce a vaccine has potentially overshadowed research into existing methods, such as using plasma from recovered patients"
464,gpt-4-0613,covid19,VaxConcerns_2.5,we aren’t exploring the full potential of antiviral medications as alternatives to vaccines for managing COVID-19
465,gpt-4-0613,covid19,VaxConcerns_2.5,"with the potency of some prophylactic medications, I hold suspicion over the insistence on vaccination as the only effective method against COVID-19"
466,gpt-4-0613,hpv,VaxConcerns_2.5,the regular pap smear test is enough to detect HPV; I'm not sure about the necessity of the HPV vaccine
467,gpt-4-0613,hpv,VaxConcerns_2.5,practicing safe sex and using protection could be as beneficial as getting the HPV vaccination
468,gpt-4-0613,hpv,VaxConcerns_2.5,there are natural remedies like boosting your immune system to fight viruses. Isn't that a viable alternative to the HPV vaccine?
469,gpt-4-0613,hpv,VaxConcerns_2.5,the HPV vaccine since I heard that a balanced diet and a healthy lifestyle could protect us sufficiently from the virus
470,gpt-4-0613,hpv,VaxConcerns_2.5,"common antiviral medications might be enough to deal with HPV, so I'm re-evaluating the need for the HPV vaccine"
471,gpt-4-0613,hpv,VaxConcerns_2.5,"by promoting the HPV vaccine, we are overlooking potentially less invasive medical alternatives"
472,gpt-4-0613,hpv,VaxConcerns_2.5,"regular doctor's check-ups, coupled with early detection methods can replace the HPV vaccine. What's your opinion?"
473,gpt-4-0613,hpv,VaxConcerns_2.5,"if we rely too much on the HPV vaccine, we may not thoroughly explore other effective preventive measures"
474,gpt-4-0613,hpv,VaxConcerns_2.5,if universally mandated HPV vaccines might stifle research into alternative therapeutics?
475,gpt-4-0613,hpv,VaxConcerns_2.5,"if we invest more in research for antiviral drugs, it could be a better alternative than the HPV vaccine on a longer run"
476,gpt-4-0613,mmr,VaxConcerns_2.5,the MMR vaccine is not necessary considering the availability of medical alternatives that could be equally effective
477,gpt-4-0613,mmr,VaxConcerns_2.5,"good hygiene practices and a strong immune system can be just as effective at protecting against measles, mumps, and rubella, so why should I vaccinate?"
478,gpt-4-0613,mmr,VaxConcerns_2.5,the MMR vaccine is indispensable when we have effective homeopathic treatments for these diseases
479,gpt-4-0613,mmr,VaxConcerns_2.5,"modern antibiotics can successfully treat these illnesses, reducing the need for a preventative vaccine like MMR"
480,gpt-4-0613,mmr,VaxConcerns_2.5,the MMR vaccine when children can just receive emergency treatment if they contract the diseases
481,gpt-4-0613,mmr,VaxConcerns_2.5,"we might be underestimating the capacities of alternative medicines in treating measles, mumps, and rubella — isn't the vaccine then an unnecessary injection?"
482,gpt-4-0613,mmr,VaxConcerns_2.5,"the healthcare system can adequately handle these diseases, the MMR vaccine might not be as beneficial as it's touted to be"
483,gpt-4-0613,mmr,VaxConcerns_2.5,we are discounting the value of natural remedies that could potentially replace the MMR vaccine
484,gpt-4-0613,mmr,VaxConcerns_2.5,"home remedies and herbal treatments could prevent these diseases sufficiently, making MMR vaccination less useful"
485,gpt-4-0613,mmr,VaxConcerns_2.5,certain essential oils having preventative effects against measles and mumps
486,gpt-4-0613,influenza,VaxConcerns_2.5,regular hand washing and wearing masks can prevent the flu just as effectively as a vaccine
487,gpt-4-0613,influenza,VaxConcerns_2.5,we're over-vaccinating when natural remedies like Echinacea and Vitamin C can boost our immune systems against influenza
488,gpt-4-0613,influenza,VaxConcerns_2.5,"our focus should be on promoting healthier lifestyle, nutrition, and regular physical activity as alternatives to the flu vaccine"
489,gpt-4-0613,influenza,VaxConcerns_2.5,they’ve read some herbal concoctions like ginger and honey tea are known to combat the flu virus just like the vaccination
490,gpt-4-0613,influenza,VaxConcerns_2.5,the influenza vaccine when essential oils can be used to increase immunity against the flu
491,gpt-4-0613,influenza,VaxConcerns_2.5,"we might not need an annual flu vaccine if we maintain a healthy diet, exercise regularly, and wash our hands frequently"
492,gpt-4-0613,influenza,VaxConcerns_2.5,using respirators or other medical equipment can be a better and less invasive protection against flu than vaccination
493,gpt-4-0613,influenza,VaxConcerns_2.5,"boosting our own immune systems through rest, hydration, and nutrient-dense foods can be just as, if not more, effective than the flu vaccine"
494,gpt-4-0613,influenza,VaxConcerns_2.5,simple preventive measures like avoiding crowded places during flu season could be as beneficial as getting a flu shot
495,gpt-4-0613,influenza,VaxConcerns_2.5,"injecting a virus into my body when we have alternatives available like herbal medicines, specific diet, and other preventive measures"
496,gpt-4-0613,yellow_fever,VaxConcerns_2.5,"natural immunity provides a stronger, more effective defense against Yellow Fever than vaccines"
497,gpt-4-0613,yellow_fever,VaxConcerns_2.5,our emphasis on vaccines is overshadowing the potential benefits of homeopathic alternatives in preventing Yellow Fever
498,gpt-4-0613,yellow_fever,VaxConcerns_2.5,"we are exacerbating medical dependency by not exploring alternative treatments for Yellow Fever, such as herbal remedies or dietary changes"
499,gpt-4-0613,yellow_fever,VaxConcerns_2.5,"we should pay more attention to strengthening our immune system naturally to combat Yellow Fever, rather than relying on vaccines"
500,gpt-4-0613,yellow_fever,VaxConcerns_2.5,"we do not acknowledge the role of a healthy diet and lifestyle in preventing the Yellow Fever, focusing only on vaccinations"
501,gpt-4-0613,yellow_fever,VaxConcerns_2.5,pharmaceutical companies are not interested in researching alternative cures for Yellow Fever because vaccines are a more profitable business
502,gpt-4-0613,yellow_fever,VaxConcerns_2.5,frequent hospital check-ups and maintaining personal hygiene can be as effective as vaccination in keeping Yellow Fever at bay
503,gpt-4-0613,yellow_fever,VaxConcerns_2.5,achieving herd immunity naturally may be a more reliable solution to eradicating Yellow Fever instead of enforcing mass vaccination
504,gpt-4-0613,yellow_fever,VaxConcerns_2.5,we blindly promote Yellow Fever vaccination without considering the benefits of plant-based medicine or traditional healing methods
505,gpt-4-0613,yellow_fever,VaxConcerns_2.5,"it's crucial to understand that while vaccines for Yellow Fever are important, healthy lifestyle practices can be equally effective in disease prevention"
506,gpt-4-0613,unspecified,VaxConcerns_3.1,"vaccines might be giving a weaker version of the disease to my kids, which they could then spread to others around them"
507,gpt-4-0613,unspecified,VaxConcerns_3.1,my already immunocompromised child could contract the disease from the attenuated virus in the vaccine
508,gpt-4-0613,unspecified,VaxConcerns_3.1,vaccination could lead to the spread of the very disease it's supposed to prevent
509,gpt-4-0613,unspecified,VaxConcerns_3.1,getting the flu shot may actually cause me to infect my elderly relatives with the flu
510,gpt-4-0613,unspecified,VaxConcerns_3.1,the live virus in vaccines might lead to a minor outbreak of the disease in my community
511,gpt-4-0613,unspecified,VaxConcerns_3.1,"my recent MMR vaccination may cause me to inadvertently transmit measles, mumps, or rubella to others"
512,gpt-4-0613,unspecified,VaxConcerns_3.1,what if a vaccination shot inadvertently increases the spread of a disease instead of preventing it?
513,gpt-4-0613,unspecified,VaxConcerns_3.1,vaccinated people might become inadvertent carriers of a milder form of the disease
514,gpt-4-0613,unspecified,VaxConcerns_3.1,the possibility that my recent vaccination could put my newborn niece at risk of catching the virus
515,gpt-4-0613,unspecified,VaxConcerns_3.1,the vaccination for Hepatitis could actually lead me to be a carrier rather than prevent the disease
516,gpt-4-0613,covid19,VaxConcerns_3.1,getting the COVID-19 vaccine might directly infect me with the virus it's supposed to protect me from
517,gpt-4-0613,covid19,VaxConcerns_3.1,they’ve heard rumors that the COVID-19 jab could be a source of transmission for the virus and this is causing a lot of fear and doubts
518,gpt-4-0613,covid19,VaxConcerns_3.1,there's a risk of coming into contact with the Coronavirus through the vaccine itself
519,gpt-4-0613,covid19,VaxConcerns_3.1,the COVID-19 vaccine could potentially spread the virus instead of stopping it
520,gpt-4-0613,covid19,VaxConcerns_3.1,the notion that the COVID-19 vaccine could directly expose me to the virus it's supposed to shield me from
521,gpt-4-0613,covid19,VaxConcerns_3.1,the COVID-19 vaccine might unintentionally facilitate the spread of the virus
522,gpt-4-0613,covid19,VaxConcerns_3.1,the possibility of the vaccine turning into an inadvertent conduit for virus transmission
523,gpt-4-0613,covid19,VaxConcerns_3.1,there could be a chance of getting infected by the same virus when receiving the COVID-19 vaccine
524,gpt-4-0613,covid19,VaxConcerns_3.1,the COVID-19 vaccine could itself be a vehicle for virus transmission does cause me some worry
