concern_id,source,vaccine_type,class,statement
525,gpt-4-0613,covid19,VaxConcerns_3.1,"getting vaccinated might put me, ironically, at risk of catching the virus firsthand"
526,gpt-4-0613,hpv,VaxConcerns_3.1,getting the HPV vaccine might increase my chances of contracting the virus directly from the injection
527,gpt-4-0613,hpv,VaxConcerns_3.1,"the HPV shot could introduce the virus into your body, is that true?"
528,gpt-4-0613,hpv,VaxConcerns_3.1,the vaccination process itself can spread the virus
529,gpt-4-0613,hpv,VaxConcerns_3.1,the risk of getting HPV from the vaccine is too high to consider it safe for use
530,gpt-4-0613,hpv,VaxConcerns_3.1,"you could catch HPV straight from the vaccine, as I've heard it can happen sometimes"
531,gpt-4-0613,hpv,VaxConcerns_3.1,doctors should be more open about the potential for the HPV vaccine to transfer the virus directly
532,gpt-4-0613,hpv,VaxConcerns_3.1,"the HPV vaccine might cause direct transmission of the virus, is that accurate?"
533,gpt-4-0613,hpv,VaxConcerns_3.1,the HPV vaccine may not be entirely safe and might even lead to the direct spread of the virus
534,gpt-4-0613,hpv,VaxConcerns_3.1,"the HPV vaccine itself could transmit the virus, I am hesitant to give it to my kids"
535,gpt-4-0613,hpv,VaxConcerns_3.1,the HPV vaccination process because I've been told that it could result in directly contracting the virus
536,gpt-4-0613,mmr,VaxConcerns_3.1,my child might catch the measles from the MMR vaccine itself
537,gpt-4-0613,mmr,VaxConcerns_3.1,we're at a risk of spreading mumps disease simply by getting the MMR vaccination
538,gpt-4-0613,mmr,VaxConcerns_3.1,there's a possibility of inadvertently transmitting Rubella to my immune-compromised spouse through the MMR vaccine
539,gpt-4-0613,mmr,VaxConcerns_3.1,there's a danger of the MMR vaccine causing a mild form of the diseases they are supposed to prevent
540,gpt-4-0613,mmr,VaxConcerns_3.1,"the MMR vaccine might actually initiate an outbreak of these diseases, instead of preventing them"
541,gpt-4-0613,mmr,VaxConcerns_3.1,the MMR vaccine could pose a risk for those with weakened immune systems by directly transmitting the disease
542,gpt-4-0613,mmr,VaxConcerns_3.1,my child could get the Rubella infection from the MMR vaccine instead of being protected from it
543,gpt-4-0613,mmr,VaxConcerns_3.1,the MMR vaccine might cause more harm than good by transmitting the very diseases it aims to prevent
544,gpt-4-0613,mmr,VaxConcerns_3.1,"the MMR vaccine might essentially infect children with measles, mumps, or rubella"
545,gpt-4-0613,mmr,VaxConcerns_3.1,"the MMR vaccination could lead to a direct transmission of these diseases, ultimately causing a health risk"
546,gpt-4-0613,influenza,VaxConcerns_3.1,"I might actually transmit the flu to my newborn after I get the vaccine, as I have heard about this happening"
547,gpt-4-0613,influenza,VaxConcerns_3.1,getting the influenza vaccine could make me a carrier and spread the disease to others at risk in my community
548,gpt-4-0613,influenza,VaxConcerns_3.1,"if I get the flu shot, I might contract the virus from it and end up infecting my ailing grandmother"
549,gpt-4-0613,influenza,VaxConcerns_3.1,I’m really worried that getting the flu shot will just result in me getting sick and passing it on to my kids
550,gpt-4-0613,influenza,VaxConcerns_3.1,"the vaccine may give me the flu, which could cause me to pass the disease along to others"
551,gpt-4-0613,influenza,VaxConcerns_3.1,"my elderly parents might catch the flu from me if I get the shot, which supposedly might make me infectious for some time"
552,gpt-4-0613,influenza,VaxConcerns_3.1,you can catch the flu from the vaccine
553,gpt-4-0613,influenza,VaxConcerns_3.1,"the flu shot might make me a carrier of the virus, putting everyone in danger"
554,gpt-4-0613,influenza,VaxConcerns_3.1,the influenza vaccine could indirectly lead to an outbreak by turning those vaccinated into carriers of the disease
555,gpt-4-0613,influenza,VaxConcerns_3.1,I may end up spreading the flu to my coworkers if I get vaccinated due to the potential for direct transmission
556,gpt-4-0613,yellow_fever,VaxConcerns_3.1,taking the Yellow Fever vaccine might actually give me the disease
557,gpt-4-0613,yellow_fever,VaxConcerns_3.1,a close friend of mine contracted Yellow Fever directly from the vaccine
558,gpt-4-0613,yellow_fever,VaxConcerns_3.1,"there's a risk of getting the Yellow Fever just from getting vaccinated, is it true?"
559,gpt-4-0613,yellow_fever,VaxConcerns_3.1,my 2-year-old might contract the disease from the Yellow Fever vaccine
560,gpt-4-0613,yellow_fever,VaxConcerns_3.1,in some cases where people actually got Yellow Fever from the vaccine itself; this makes me quite worried
561,gpt-4-0613,yellow_fever,VaxConcerns_3.1,I may end up spreading the Yellow Fever to my family members if I get the vaccine
562,gpt-4-0613,yellow_fever,VaxConcerns_3.1,the Yellow Fever vaccine might actually give me the disease it's supposed to protect against
563,gpt-4-0613,yellow_fever,VaxConcerns_3.1,something like the Yellow Fever could be caught from the vaccine- this is what's preventing my decision to get my toddler vaccinated
564,gpt-4-0613,yellow_fever,VaxConcerns_3.1,"there's a chance of my child catching Yellow Fever directly from the vaccine, and it scares me"
565,gpt-4-0613,yellow_fever,VaxConcerns_3.1,"there’s a post about a person contracting Yellow Fever from the vaccination, and it made me worry about the safety of the vaccination"
566,gpt-4-0613,unspecified,VaxConcerns_3.2,vaccines contain harmful ingredients like mercury and formaldehyde which could adversely affect my child's health
567,gpt-4-0613,unspecified,VaxConcerns_3.2,the aluminum used as an adjuvant in certain vaccines can lead to neurological disorders
568,gpt-4-0613,unspecified,VaxConcerns_3.2,pharmaceutical companies do not do enough to ensure that vaccine ingredients are safe for all individuals
569,gpt-4-0613,unspecified,VaxConcerns_3.2,"some vaccines use egg proteins, which could be dangerous for those with severe allergies"
570,gpt-4-0613,unspecified,VaxConcerns_3.2,"the combination of various chemicals in vaccines can interact negatively, causing health problems"
571,gpt-4-0613,unspecified,VaxConcerns_3.2,the use of Thimerosal as a preservative in vaccines might lead to autism in children
572,gpt-4-0613,unspecified,VaxConcerns_3.2,the long-term effects of vaccines could be harmful due to the preservatives they contain
573,gpt-4-0613,unspecified,VaxConcerns_3.2,that vaccines contain controversial ingredients such as formaldehyde and aluminum
574,gpt-4-0613,unspecified,VaxConcerns_3.2,the harmful ingredients within vaccines could possibly cause more harm than the diseases they're meant to protect against
575,gpt-4-0613,unspecified,VaxConcerns_3.2,"the use of gelatin in vaccines, as it's known to cause allergic reactions in some people"
576,gpt-4-0613,covid19,VaxConcerns_3.2,the COVID-19 vaccine contains harmful chemicals that could impact my health long-term
577,gpt-4-0613,covid19,VaxConcerns_3.2,the substances used in formulating the COVID-19 vaccine might be toxic to my body
578,gpt-4-0613,covid19,VaxConcerns_3.2,the COVID-19 vaccine carries damaging ingredients that can lead to unforeseen health issues
579,gpt-4-0613,covid19,VaxConcerns_3.2,"the safety of the ingredients used in the COVID-19 vaccine."""
580,gpt-4-0613,covid19,VaxConcerns_3.2,the vaccines for COVID-19 include substances that are harmful to the immune system
581,gpt-4-0613,covid19,VaxConcerns_3.2,the COVID-19 vaccine has potentially dangerous ingredients that could cause health problems
582,gpt-4-0613,covid19,VaxConcerns_3.2,"the concoction of components used in the COVID-19 vaccine, suspecting them to be unsafe for humans"
583,gpt-4-0613,covid19,VaxConcerns_3.2,the harmful contents that may be present in the COVID-19 vaccine
584,gpt-4-0613,covid19,VaxConcerns_3.2,the elements used to develop the COVID-19 vaccines can detrimentally affect our physical well-being
585,gpt-4-0613,covid19,VaxConcerns_3.2,the COVID-19 vaccine may have risky ingredients that have not been fully tested for long-term safety
586,gpt-4-0613,hpv,VaxConcerns_3.2,the Human Papillomavirus (HPV) vaccine contains harmful ingredients that could be detrimental to my health
587,gpt-4-0613,hpv,VaxConcerns_3.2,the hazardous substances in the HPV vaccine may cause health issues in the long run
588,gpt-4-0613,hpv,VaxConcerns_3.2,the substances used in HPV vaccines may not be entirely safe for human health
589,gpt-4-0613,hpv,VaxConcerns_3.2,certain substances in the HPV vaccine might be harmful to my child's health
590,gpt-4-0613,hpv,VaxConcerns_3.2,the HPV vaccine has ingredients that could potentially pose risks to our health
591,gpt-4-0613,hpv,VaxConcerns_3.2,the potentially hazardous ingredients included in the HPV vaccine
592,gpt-4-0613,hpv,VaxConcerns_3.2,there's any health risks associated with the harmful substances in the HPV vaccine
593,gpt-4-0613,hpv,VaxConcerns_3.2,"the HPV vaccine contains potentially harmful ingredients, and I'm worried about the health risks"
594,gpt-4-0613,hpv,VaxConcerns_3.2,the HPV vaccine might contain dangerous substances that could risk my health in the long term
595,gpt-4-0613,hpv,VaxConcerns_3.2,the ingredients used in HPV vaccines might lead to unforeseen health risks
596,gpt-4-0613,mmr,VaxConcerns_3.2,the MMR vaccine might contain harmful ingredients that could adversely affect my health
597,gpt-4-0613,mmr,VaxConcerns_3.2,"there could be dangerous substances in the Measles, Mumps, and Rubella vaccine that may pose health hazards"
598,gpt-4-0613,mmr,VaxConcerns_3.2,some of the things used to make MMR vaccines could cause riskier health issues than the diseases they are supposed to protect us from
599,gpt-4-0613,mmr,VaxConcerns_3.2,health risks due to harmful components in the MMR vaccine might be downplayed by doctors
600,gpt-4-0613,mmr,VaxConcerns_3.2,we should be very cautious about the potentially dangerous ingredients in the MMR vaccine
601,gpt-4-0613,mmr,VaxConcerns_3.2,the harmful ingredients in the MMR vaccine could potentially provoke an undesirable medical condition
602,gpt-4-0613,mmr,VaxConcerns_3.2,the MMR vaccine features potentially harmful chemical compounds that might be a hidden cause of other diseases
603,gpt-4-0613,mmr,VaxConcerns_3.2,some ingredients in the MMR vaccine might carry inadvertent health risks and adverse reactions
604,gpt-4-0613,mmr,VaxConcerns_3.2,"there might be hazardous components in the MMR vaccine, and their potential implications on health need further investigation"
605,gpt-4-0613,mmr,VaxConcerns_3.2,we might be introducing harmful substances into our bodies through the MMR vaccine
606,gpt-4-0613,influenza,VaxConcerns_3.2,the harmful ingredients in the influenza vaccine could be linked to neurological disorders
607,gpt-4-0613,influenza,VaxConcerns_3.2,the mercury contained in the flu vaccine could be detrimental to my health
608,gpt-4-0613,influenza,VaxConcerns_3.2,the aluminum used in the influenza vaccine can lead to serious side effects
609,gpt-4-0613,influenza,VaxConcerns_3.2,the influenza vaccine because it might contain substances like formaldehyde that could hazard my health
610,gpt-4-0613,influenza,VaxConcerns_3.2,the egg proteins in flu vaccine may cause an allergic reaction to those allergic to eggs
611,gpt-4-0613,influenza,VaxConcerns_3.2,the trace amounts of antibiotics in the flu shot could possibly lead to antibiotic resistance
612,gpt-4-0613,influenza,VaxConcerns_3.2,"the influenza vaccine contains thimerosal, a mercury-based preservative, which may lead to developmental disorders"
613,gpt-4-0613,influenza,VaxConcerns_3.2,the influenza vaccine includes potentially harmful substances like polysorbate 80
614,gpt-4-0613,influenza,VaxConcerns_3.2,"the influenza vaccines contain gelatin, which might cause allergic reactions"
615,gpt-4-0613,influenza,VaxConcerns_3.2,the use of preservatives in the flu vaccine might disrupt my body's natural immunity
616,gpt-4-0613,yellow_fever,VaxConcerns_3.2,the Yellow Fever vaccine might contain unnecessary additives that could harm my body
617,gpt-4-0613,yellow_fever,VaxConcerns_3.2,the preservatives used in the Yellow Fever vaccine could potentially have long-term health risks
618,gpt-4-0613,yellow_fever,VaxConcerns_3.2,what exactly goes into the Yellow Fever vaccine
619,gpt-4-0613,yellow_fever,VaxConcerns_3.2,there are stories about toxic ingredients
620,gpt-4-0613,yellow_fever,VaxConcerns_3.2,the harmful side effects I might experience due to certain ingredients in the Yellow Fever vaccine
621,gpt-4-0613,yellow_fever,VaxConcerns_3.2,the manufacturers might not be disclosing all the potentially harmful ingredients in the Yellow Fever vaccine
622,gpt-4-0613,yellow_fever,VaxConcerns_3.2,certain chemicals in the Yellow Fever vaccine can have major repercussions on my health
623,gpt-4-0613,yellow_fever,VaxConcerns_3.2,the fillers used in Yellow Fever vaccines could cause allergic reactions
624,gpt-4-0613,yellow_fever,VaxConcerns_3.2,there are harmful ingredients in the Yellow Fever vaccine that could lead to unexpected health problems
625,gpt-4-0613,yellow_fever,VaxConcerns_3.2,getting vaccinated for Yellow Fever could expose me to harmful toxins contained within the vaccine ingredients
626,gpt-4-0613,unspecified,VaxConcerns_3.3,my child will develop an allergic reaction to the vaccine ingredients
627,gpt-4-0613,unspecified,VaxConcerns_3.3,news stories that suggest a link between vaccines and severe side effects ranging from autoimmune diseases to autism
628,gpt-4-0613,unspecified,VaxConcerns_3.3,an article claimed vaccines could result in brain damage
629,gpt-4-0613,unspecified,VaxConcerns_3.3,the measles vaccine may cause deafness in some children as per a recent study I came across
630,gpt-4-0613,unspecified,VaxConcerns_3.3,getting the COVID-19 vaccine because I heard it can lead to blood clots
631,gpt-4-0613,unspecified,VaxConcerns_3.3,"vaccines could cause serious side effects like seizures, and that scares me"
632,gpt-4-0613,unspecified,VaxConcerns_3.3,the HPV vaccine could potentially cause infertility in the future
633,gpt-4-0613,unspecified,VaxConcerns_3.3,taking a vaccine may result in chronic conditions like Guillain–Barré syndrome
634,gpt-4-0613,unspecified,VaxConcerns_3.3,"the claim that the flu vaccine can cause paralysis, as hinted at in some studies"
635,gpt-4-0613,unspecified,VaxConcerns_3.3,some can potentially lead to a life-threatening condition called anaphylaxis
636,gpt-4-0613,covid19,VaxConcerns_3.3,the COVID-19 vaccine can cause severe allergic reactions in some individuals
637,gpt-4-0613,covid19,VaxConcerns_3.3,getting vaccinated for COVID-19 can lead to major side effects like heart inflammation
638,gpt-4-0613,covid19,VaxConcerns_3.3,"this vaccine potentially causes Bell's palsy, and honestly, that worries me"
639,gpt-4-0613,covid19,VaxConcerns_3.3,"the COVID-19 vaccine might contribute to blood clot issues, as some reports suggest"
640,gpt-4-0613,covid19,VaxConcerns_3.3,"the COVID-19 vaccine could cause severe flu-like symptoms, and I am not convinced otherwise"
641,gpt-4-0613,covid19,VaxConcerns_3.3,"the COVID-19 vaccine might trigger a severe, long-term fatigue"
642,gpt-4-0613,covid19,VaxConcerns_3.3,"the vaccine might cause facial paralysis, especially after seeing some reports online"
643,gpt-4-0613,covid19,VaxConcerns_3.3,"it might lead to high fever, which adversely affects people with a specific health condition"
644,gpt-4-0613,covid19,VaxConcerns_3.3,"the link explained between COVID-19 vaccines and Guillain-Barre Syndrome, even though it's rare"
645,gpt-4-0613,covid19,VaxConcerns_3.3,this vaccine might trigger neurological complications in the long run based on some reports
646,gpt-4-0613,hpv,VaxConcerns_3.3,"HPV vaccine can lead to severe allergic reactions, which is very alarming"
647,gpt-4-0613,hpv,VaxConcerns_3.3,receiving the HPV vaccine could potentially lead to fainting spells in my daughter
648,gpt-4-0613,hpv,VaxConcerns_3.3,"the HPV vaccination might cause a severe arm swelling at the injection site, which I've heard is fairly common"
649,gpt-4-0613,hpv,VaxConcerns_3.3,"the risk of blood clotting after receiving the HPV vaccine outweighs the benefits, so it's not worth it"
650,gpt-4-0613,hpv,VaxConcerns_3.3,"the HPV vaccine may cause my child to develop influenza-like symptoms, which is not something we want to face"
651,gpt-4-0613,hpv,VaxConcerns_3.3,the possibility of experiencing a fever after receiving the HPV vaccine is too high and can't be discounted
652,gpt-4-0613,hpv,VaxConcerns_3.3,the potential for long-term side effects of the HPV vaccine such as chronic fatigue syndrome
653,gpt-4-0613,hpv,VaxConcerns_3.3,the HPV vaccine can possibly lead to bouts of dizziness which can be very disruptive
654,gpt-4-0613,hpv,VaxConcerns_3.3,"the HPV vaccine can cause severe nausea, even though I understand it's not a common occurrence"
655,gpt-4-0613,hpv,VaxConcerns_3.3,"the HPV vaccine may lead to joint pain, and I think that's a risk I'm not comfortable with"
656,gpt-4-0613,mmr,VaxConcerns_3.3,"the Measles, Mumps, Rubella vaccine (MMR) will cause severe allergic reactions in my child"
657,gpt-4-0613,mmr,VaxConcerns_3.3,taking the MMR vaccine could lead to high fever and make someone's condition worse
658,gpt-4-0613,mmr,VaxConcerns_3.3,"the MMR vaccine can cause joint pain and stiffness, which makes me hesitant to vaccinate my kids"
659,gpt-4-0613,mmr,VaxConcerns_3.3,"the MMR vaccine might cause memory loss or mental problems, considering the rumors I have heard"
660,gpt-4-0613,mmr,VaxConcerns_3.3,the MMR vaccine can cause serious side effects including seizures or severe headaches
661,gpt-4-0613,mmr,VaxConcerns_3.3,"the MMR vaccine might cause hearing loss, as I came across some reports citing this"
662,gpt-4-0613,mmr,VaxConcerns_3.3,"the MMR vaccine could lead to deafness, after seeing some unconfirmed reports online"
663,gpt-4-0613,mmr,VaxConcerns_3.3,the side effect of the MMR vaccine potentially causing long-term nerve damage
664,gpt-4-0613,mmr,VaxConcerns_3.3,"that the MMR vaccine might induce immediate vomiting episodes, as I've heard from others' experiences"
665,gpt-4-0613,mmr,VaxConcerns_3.3,fainting spells could result from the vaccine
666,gpt-4-0613,influenza,VaxConcerns_3.3,getting the flu shot could actually give me the virus
667,gpt-4-0613,influenza,VaxConcerns_3.3,I might suffer from severe allergic reactions after getting the Influenza vaccine
668,gpt-4-0613,influenza,VaxConcerns_3.3,the side effects of an influenza vaccine can be Guillain-Barré Syndrome
669,gpt-4-0613,influenza,VaxConcerns_3.3,"the influenza vaccine may have severe side effects on my children, especially those under the age of 5"
670,gpt-4-0613,influenza,VaxConcerns_3.3,the possible adverse effects of the flu vaccine like intense body aches and fever
671,gpt-4-0613,influenza,VaxConcerns_3.3,"I've heard that the flu vaccine can cause fainting, and this gives me anxiety"
672,gpt-4-0613,influenza,VaxConcerns_3.3,the Influenza vaccine might lead to muscle weakness or changes in heart rate
673,gpt-4-0613,influenza,VaxConcerns_3.3,there's a small chance that the vaccine could trigger an autoimmune response
674,gpt-4-0613,influenza,VaxConcerns_3.3,the flu shot may cause me severe pain at the injection site
675,gpt-4-0613,influenza,VaxConcerns_3.3,"the potential side effect of developing a high fever from the flu vaccine, as it could lead to other complications"
676,gpt-4-0613,yellow_fever,VaxConcerns_3.3,the yellow fever vaccine might lead to serious neurological reactions in some people
677,gpt-4-0613,yellow_fever,VaxConcerns_3.3,there's a possibility that the yellow fever vaccine could cause mild fever and muscle pain
678,gpt-4-0613,yellow_fever,VaxConcerns_3.3,receiving the yellow fever vaccine might result in a severe allergic reaction in some individuals
679,gpt-4-0613,yellow_fever,VaxConcerns_3.3,the yellow fever vaccine could potentially lead to problems with my immune system
680,gpt-4-0613,yellow_fever,VaxConcerns_3.3,"the yellow fever vaccine might not be safe for pregnant women, of increasing chances of birth defects"
681,gpt-4-0613,yellow_fever,VaxConcerns_3.3,the yellow fever vaccine might lead to short-term side effects like soreness or a rash at the injection site
682,gpt-4-0613,yellow_fever,VaxConcerns_3.3,the yellow fever vaccine might bring about an unexpected allergic response
683,gpt-4-0613,yellow_fever,VaxConcerns_3.3,the yellow fever vaccine could trigger life-threatening conditions such as Yellow Fever Vaccine-Associated Viscerotropic Disease (YEL-AVD)
684,gpt-4-0613,yellow_fever,VaxConcerns_3.3,the yellow fever vaccine might lead to severe headaches or breathing difficulties
685,gpt-4-0613,yellow_fever,VaxConcerns_3.3,"the yellow fever vaccine could cause potentially debilitating side effects like fatigue, muscle weakness, or balance issues"
686,gpt-4-0613,unspecified,VaxConcerns_3.4,the storage conditions for vaccines might lead to them becoming harmful instead of helpful
687,gpt-4-0613,unspecified,VaxConcerns_3.4,"my daughter's allergic reaction might have been due to the unsterilized needle used, and not the vaccine itself"
688,gpt-4-0613,unspecified,VaxConcerns_3.4,the rushed nature of vaccination drives can potentially lead to mix-ups and consequent health issues
689,gpt-4-0613,unspecified,VaxConcerns_3.4,the clinic staff is not trained well enough to handle possible adverse reactions during vaccination
690,gpt-4-0613,unspecified,VaxConcerns_3.4,the cause of my son's illness post-vaccination might be linked to the clinic's sanitary conditions and not the actual vaccine
691,gpt-4-0613,unspecified,VaxConcerns_3.4,vaccines might lose their effectiveness if not stored under the required conditions
692,gpt-4-0613,unspecified,VaxConcerns_3.4,the lack of regulation in some vaccination centers leading to possible hazards
693,gpt-4-0613,unspecified,VaxConcerns_3.4,the healthcare workers are not taking enough precautions while delivering vaccines
694,gpt-4-0613,unspecified,VaxConcerns_3.4,improper handling of vaccines during transport could be a reason behind some reported side effects
695,gpt-4-0613,unspecified,VaxConcerns_3.4,receiving vaccines at mass vaccination events where mistakes due to overcrowding could happen
696,gpt-4-0613,covid19,VaxConcerns_3.4,the process of giving out the COVID-19 vaccine in public places might contribute to potential cross contamination and increased risk of infection
697,gpt-4-0613,covid19,VaxConcerns_3.4,"by rushing to administer COVID-19 vaccines, there's too much room for mishandling, which may impose health risks"
698,gpt-4-0613,covid19,VaxConcerns_3.4,the lack of proper hygiene in vaccination centers could lead to other health issues unrelated to the vaccine contents itself
699,gpt-4-0613,covid19,VaxConcerns_3.4,delivering the vaccine in mass vaccination events could put individuals at risk of contracting other diseases
700,gpt-4-0613,covid19,VaxConcerns_3.4,"the stress associated with waiting in long lines for the vaccine can be harmful for older folks, which makes vaccine delivery a health risk"
701,gpt-4-0613,covid19,VaxConcerns_3.4,that keeping vaccines at incorrect temperature could impair their safety and efficacy
702,gpt-4-0613,covid19,VaxConcerns_3.4,"nurses overworked due to high demand for vaccination might make mistakes during administration, leading to health problems"
703,gpt-4-0613,covid19,VaxConcerns_3.4,lack of rest in between vaccinations for healthcare professionals could lead to human errors while delivering the vaccine
704,gpt-4-0613,covid19,VaxConcerns_3.4,improper sanitation practices during vaccine distribution might lead to infections other than COVID-19
705,gpt-4-0613,covid19,VaxConcerns_3.4,"if we misuse syringes or accidentally contaminate the vaccine while handling, it could lead to unpredictable health consequences"
706,gpt-4-0613,hpv,VaxConcerns_3.4,the administration of the HPV vaccine may not be safe if it's done incorrectly
707,gpt-4-0613,hpv,VaxConcerns_3.4,my child's health could be compromised due to poor vaccine delivery practices
708,gpt-4-0613,hpv,VaxConcerns_3.4,"the problem is not the HPV vaccine itself, but rather how it's administered. Who ensures that the people giving the shot were properly trained?"
709,gpt-4-0613,hpv,VaxConcerns_3.4,the delivery of vaccines can be as risky as the diseases they seem to prevent
710,gpt-4-0613,hpv,VaxConcerns_3.4,a possible infection from the actual injection process could outweigh the benefits of having the HPV vaccine
711,gpt-4-0613,hpv,VaxConcerns_3.4,the HPV vaccine is not as dangerous as the circumstances under which it may be administered
712,gpt-4-0613,hpv,VaxConcerns_3.4,"it seems like the HPV vaccine administration procedures are not always followed carefully, which scares me"
713,gpt-4-0613,hpv,VaxConcerns_3.4,"the real threat is not the HPV vaccine, but the risk of the needle being unsanitary or the person administering it mishandling the process"
714,gpt-4-0613,hpv,VaxConcerns_3.4,"the HPV vaccine; not because of what's in it, but for the possible health risks due to improper vaccine delivery"
715,gpt-4-0613,hpv,VaxConcerns_3.4,"the health threats may not stem from the HPV vaccine itself, but rather from unhygienic practices during its administration"
716,gpt-4-0613,mmr,VaxConcerns_3.4,"the measles, mumps, and rubella (MMR) vaccine might be dangerous if not stored properly prior to vaccination"
717,gpt-4-0613,mmr,VaxConcerns_3.4,"the health risks attributed to the MMR vaccine may be more related to the condition of the medical equipment used, rather than the vaccine itself"
