concern_id,source,vaccine_type,class,statement
0,human,unspecified,VaxConcerns_1,there are issues with the research of vaccines
1,human,unspecified,VaxConcerns_1.1,there is not enough quantity of research regarding vaccines
2,human,unspecified,VaxConcerns_1.2,the research on vaccines is low-quality
3,human,unspecified,VaxConcerns_1.3,science could be wrong about their conclusions on vaccination
4,human,unspecified,VaxConcerns_2,the vaccine has limited benefits
5,human,unspecified,VaxConcerns_2.1,the protection you get from vaccines is imperfect
6,human,unspecified,VaxConcerns_2.2,you might still get infected even if you get vaccinated
7,human,unspecified,VaxConcerns_2.2,you can get protection from the disease from herd immunity instead of the vaccine
8,human,unspecified,VaxConcerns_2.3,natural immunity is better than immunity from vaccination
9,human,unspecified,VaxConcerns_2.4,the disease isn’t dangerous enough to warrant getting vaccinated
10,human,unspecified,VaxConcerns_2.5,the virus isn’t common enough to justify getting vaccinated
11,human,unspecified,VaxConcerns_2.5,there are better alternatives to getting vaccinated
12,human,unspecified,VaxConcerns_3,there are health risks to getting vaccinated
13,human,unspecified,VaxConcerns_3.1,you can get sick from the vaccine
14,human,unspecified,VaxConcerns_3.2,there are harmful ingredients in vaccines
15,human,unspecified,VaxConcerns_3.3,the vaccine has bad side effects
16,human,unspecified,VaxConcerns_3.4,multiple vaccinations may overwhelm the immune system
17,human,unspecified,VaxConcerns_3.5,certain individuals have a higher risk for harm when getting vaccinated
18,human,unspecified,VaxConcerns_4,vaccination often disregard individual rights
19,human,unspecified,VaxConcerns_4.1,their religion doesn’t allow them to get vaccinated
20,human,unspecified,VaxConcerns_4.2,they have a right to choose not to get vaccinated
21,human,unspecified,VaxConcerns_5,certain people involved with vaccines are untrustworthy
22,human,unspecified,VaxConcerns_5.1,the people involved with vaccination are incompetent
23,human,unspecified,VaxConcerns_5.2,vaccines are mainly pushed so companies can earn profit
24,human,unspecified,VaxConcerns_5.3,negative information about vaccines gets censored
25,human,unspecified,VaxConcerns_5.4,vaccination is a conspiracy
26,gpt-4-0613,unspecified,VaxConcerns_1.1,we need more research data evaluating the interactions of vaccinations with various chronic illnesses
27,gpt-4-0613,unspecified,VaxConcerns_1.1,we don't have sufficient research to fully understand the cumulative effects of multiple vaccines administered at the same time
28,gpt-4-0613,unspecified,VaxConcerns_1.1,there has been too little research looking into potential genetic predispositions to vaccine reactions
29,gpt-4-0613,unspecified,VaxConcerns_1.1,there are still unanswered questions regarding how the body's immune system responds to vaccinations over a lifetime
30,gpt-4-0613,unspecified,VaxConcerns_1.1,there is an inadequacy of studies investigating the efficacy of vaccines against the multitude of virus strains
31,gpt-4-0613,unspecified,VaxConcerns_1.1,there isn't enough research to confirm whether vaccines might interact with or influence other medications a person might be taking
32,gpt-4-0613,unspecified,VaxConcerns_1.1,there is a lack of substantial studies on the potential risks of vaccinating pregnant women
33,gpt-4-0613,unspecified,VaxConcerns_1.1,the volume of studies assessing vaccine effects in elderly populations is quite limited
34,gpt-4-0613,unspecified,VaxConcerns_1.1,we still need more research on the immune system's response when vaccines are given
35,gpt-4-0613,unspecified,VaxConcerns_1.1,vaccines can't truly be deemed safe or effective until additional research is conducted
36,gpt-4-0613,covid19,VaxConcerns_1.1,"there is not enough research to confidently assert the long-term impacts of the COVID-19 vaccine, as it was released fairly rapidly in response to the pandemic"
37,gpt-4-0613,covid19,VaxConcerns_1.1,there's a lack of extensive studies exploring potential side effects of the COVID-19 vaccine
38,gpt-4-0613,covid19,VaxConcerns_1.1,not enough time has been spent researching the possible adverse effects of giving the COVID-19 vaccine to pregnant women
39,gpt-4-0613,covid19,VaxConcerns_1.1,the insufficient human trials of the COVID-19 vaccine are alarming
40,gpt-4-0613,covid19,VaxConcerns_1.1,we don't have enough data on the repercussions of the COVID-19 vaccine on our immune systems
41,gpt-4-0613,covid19,VaxConcerns_1.1,there haven't been enough studies comparing the efficacy of COVID-19 vaccines from different manufacturers
42,gpt-4-0613,covid19,VaxConcerns_1.1,we do not have enough research on the long term impact of COVID-19 vaccines on those with chronic illnesses
43,gpt-4-0613,covid19,VaxConcerns_1.1,our understanding of COVID-19 vaccine interactions with other medications is hampered by a lack of research
44,gpt-4-0613,covid19,VaxConcerns_1.1,there isn't a substantial body of research addressing the COVID-19 vaccine's interactions with other vaccines
45,gpt-4-0613,covid19,VaxConcerns_1.1,we don't have enough studies proving the effectiveness of booster shots of COVID-19
46,gpt-4-0613,hpv,VaxConcerns_1.1,the amount of research available on HPV vaccines is simply insufficient
47,gpt-4-0613,hpv,VaxConcerns_1.1,we're basing our conclusions on a relatively small number of studies about the HPV vaccination
48,gpt-4-0613,hpv,VaxConcerns_1.1,the lack of substantial research into HPV vaccines makes it more of a risk
49,gpt-4-0613,hpv,VaxConcerns_1.1,the necessary comprehensive studies on HPV vaccines were not carried out
50,gpt-4-0613,hpv,VaxConcerns_1.1,the claim that HPV vaccines are safe due to the lack of numerous in-depth investigations
51,gpt-4-0613,hpv,VaxConcerns_1.1,the research related to HPV vaccines seems sparse at best
52,gpt-4-0613,hpv,VaxConcerns_1.1,there's a significant gap in the existing research around HPV vaccines
53,gpt-4-0613,hpv,VaxConcerns_1.1,medical professionals are placing too much trust in the few studies that were conducted on the HPV vaccine
54,gpt-4-0613,hpv,VaxConcerns_1.1,we've been too quick to endorse the HPV vaccine without adequate research
55,gpt-4-0613,hpv,VaxConcerns_1.1,the HPV vaccine has not been subjected to enough longitudinal studies to fully comprehend long-term effects
56,gpt-4-0613,mmr,VaxConcerns_1.1,there has not been enough comprehensive research done on the MMR vaccine to definitively prove its safety
57,gpt-4-0613,mmr,VaxConcerns_1.1,we are urging mass vaccinations without sufficient studies on the potential long-term effects of the MMR vaccine
58,gpt-4-0613,mmr,VaxConcerns_1.1,there's a serious deficit in the amount of scientific research done to address potential side effects of the MMR vaccine
59,gpt-4-0613,mmr,VaxConcerns_1.1,"despite its widespread use, there's not enough research to dispel specific fears about the MMR vaccine"
60,gpt-4-0613,mmr,VaxConcerns_1.1,there is a lack of sufficient experimentation detailing the cumulative effects of the MMR vaccine on our immune systems
61,gpt-4-0613,mmr,VaxConcerns_1.1,"our trust in the MMR vaccine may be misplaced, as there is not enough research on its potential complications"
62,gpt-4-0613,mmr,VaxConcerns_1.1,there have not been enough studies conducted targeting the various adverse reactions that could be caused by the MMR vaccine
63,gpt-4-0613,mmr,VaxConcerns_1.1,the lack of extensive research regarding the MMR vaccine's possible impact on autoimmune disorders
64,gpt-4-0613,mmr,VaxConcerns_1.1,the MMR vaccine's safety due to the lack of plentiful and detailed studies on the matter
65,gpt-4-0613,mmr,VaxConcerns_1.1,"there isn't enough substantive research into the MMR vaccine, and until more studies are conducted, some of my concerns will remain"
66,gpt-4-0613,influenza,VaxConcerns_1.1,there have not been enough longitudinal studies done on the long-term effects of the influenza vaccine
67,gpt-4-0613,influenza,VaxConcerns_1.1,there needs to be more research done on how successful the flu shot is at preventing all strains the virus
68,gpt-4-0613,influenza,VaxConcerns_1.1,not enough research has been conducted into whether the influenza vaccines are safe for all age groups
69,gpt-4-0613,influenza,VaxConcerns_1.1,there is not enough conclusive research addressing how frequently one should get the flu shot
70,gpt-4-0613,influenza,VaxConcerns_1.1,there just doesn't seem to be enough information out there about its side effects.
71,gpt-4-0613,influenza,VaxConcerns_1.1,the lack of adequate research on potential allergenic reactions to the flu vaccine is causing unnecessary worry and hesitancy
72,gpt-4-0613,influenza,VaxConcerns_1.1,there have not been enough studies comparing it to other methods of prevention
73,gpt-4-0613,influenza,VaxConcerns_1.1,there isn't enough research focusing on the interaction of the flu shot with other medications
74,gpt-4-0613,influenza,VaxConcerns_1.1,there are not enough research studies investigating the effectiveness of the flu shot in immunocompromised individuals
75,gpt-4-0613,influenza,VaxConcerns_1.1,the lack of extensive research on the impact of yearly influenza vaccinations on overall immunity is causing unnecessary fear and skepticism
76,gpt-4-0613,yellow_fever,VaxConcerns_1.1,the medical community hasn't sufficiently researched the yellow fever vaccine for me to consider it safe.
77,gpt-4-0613,yellow_fever,VaxConcerns_1.1,there are not enough studies examining the long-term effects of the yellow fever vaccine
78,gpt-4-0613,yellow_fever,VaxConcerns_1.1,there is a gaping hole of information surrounding the yellow fever vaccine due to the lack of focused research
79,gpt-4-0613,yellow_fever,VaxConcerns_1.1,our understanding of the yellow fever vaccine is compromised by insufficient scientific studies
80,gpt-4-0613,yellow_fever,VaxConcerns_1.1,"despite its widespread use, the yellow fever vaccine doesn't have enough research behind it"
81,gpt-4-0613,yellow_fever,VaxConcerns_1.1,there is a significant shortage of in-depth research about the potential side effects of the yellow fever vaccine
82,gpt-4-0613,yellow_fever,VaxConcerns_1.1,there are still too many unanswered questions about the yellow fever vaccine due to insufficient research
83,gpt-4-0613,yellow_fever,VaxConcerns_1.1,the medical community has not provided an appropriate amount of research on the safety and efficacy of the yellow fever vaccine
84,gpt-4-0613,yellow_fever,VaxConcerns_1.1,there isn't a satisfactory amount of research comparing the yellow fever vaccine with other types of vaccines
85,gpt-4-0613,yellow_fever,VaxConcerns_1.1,the dearth of comprehensive studies on the yellow fever vaccine might be hiding potential risks
86,gpt-4-0613,unspecified,VaxConcerns_1.2,this vaccine study may be flawed due to the small sample size used in the experiment
87,gpt-4-0613,unspecified,VaxConcerns_1.2,"this research on vaccines has not been peer-reviewed, which makes its validity questionable"
88,gpt-4-0613,unspecified,VaxConcerns_1.2,"the statistical methods used in this vaccine study are highly questionable, implying that the results might not be accurate"
89,gpt-4-0613,unspecified,VaxConcerns_1.2,there seems to be a lack of proper blinding and control treatments in this vaccine research which could potentially skew the results
90,gpt-4-0613,unspecified,VaxConcerns_1.2,"the current vaccine trials focus predominantly on adults, ignoring its effects on children or teen groups which could potentially lead to incorrect generalizations about vaccine efficacy"
91,gpt-4-0613,unspecified,VaxConcerns_1.2,"the data collection procedures in this vaccine study may have introduced bias, therefore I don't trust the findings"
92,gpt-4-0613,unspecified,VaxConcerns_1.2,"without addressing potential confounding variables in the vaccine study, the findings would be essentially misleading and require revisiting"
93,gpt-4-0613,unspecified,VaxConcerns_1.2,the period of observation post-vaccination in this study is far too short to declare long-term safety
94,gpt-4-0613,unspecified,VaxConcerns_1.2,there appears to be selective reporting which does not provide a comprehensive view of the vaccination effects
95,gpt-4-0613,unspecified,VaxConcerns_1.2,the lack of diversity in the participant pool of the vaccine trial raises serious concerns about the applicability of its results to diverse populations
96,gpt-4-0613,covid19,VaxConcerns_1.2,the clinical trials for the COVID-19 vaccine were rushed and didn't take all potential side-effects into account
97,gpt-4-0613,covid19,VaxConcerns_1.2,the studies related to COVID-19 vaccines were biased and driven by political and economic interests
98,gpt-4-0613,covid19,VaxConcerns_1.2,"the quality of the research done on these vaccines leaves a lot to be desired, with inadequate sample sizes in many cases"
99,gpt-4-0613,covid19,VaxConcerns_1.2,"the integrity of the COVID-19 vaccine research, it seems to me that proper clinical protocols were not completely followed"
100,gpt-4-0613,covid19,VaxConcerns_1.2,"the pressure to deliver a vaccine led to shortcuts in the research phase, potentially compromising the quality"
101,gpt-4-0613,covid19,VaxConcerns_1.2,"the double-blind methodology wasn't properly implemented in some COVID-19 vaccine trials, casting doubt on their results"
102,gpt-4-0613,covid19,VaxConcerns_1.2,the data obtained from the vaccine trials has not been vetted thoroughly enough considering the speed of approval
103,gpt-4-0613,covid19,VaxConcerns_1.2,"the sample populations used in the COVID-19 vaccine trials were diverse enough to draw clear, universal conclusions"
104,gpt-4-0613,covid19,VaxConcerns_1.2,"the adverse events during the vaccine trials were reported and handled, and what implications this has for the vaccine's safety"
105,gpt-4-0613,covid19,VaxConcerns_1.2,"the long-term safety of the COVID-19 vaccines as there's no ample historical data, and I feel the trials didn't last long enough to assure this"
106,gpt-4-0613,hpv,VaxConcerns_1.2,the initial HPV study was poorly conducted and its results should not be trusted unquestioningly
107,gpt-4-0613,hpv,VaxConcerns_1.2,"the recent HPV vaccine trial lacked sufficient population diversity, which can skew the outcome"
108,gpt-4-0613,hpv,VaxConcerns_1.2,"the research on HPV vaccines has been marred by suspiciously incomplete data reporting, so we should question its reliability"
109,gpt-4-0613,hpv,VaxConcerns_1.2,the HPV vaccine research appears to be tainted by blatant researcher bias
110,gpt-4-0613,hpv,VaxConcerns_1.2,the HPV vaccine study doesn't seem to take into account potential long-term side effects
111,gpt-4-0613,hpv,VaxConcerns_1.2,"the HPV research paper I read used flawed statistical methods, which are unreliable and easy to manipulate"
112,gpt-4-0613,hpv,VaxConcerns_1.2,"the original HPV vaccine research was unduly influenced by pharmaceutical companies, which might impact its objectivity"
113,gpt-4-0613,hpv,VaxConcerns_1.2,allegations of inadequate data collection techniques were made regarding the initial HPV vaccine tests
114,gpt-4-0613,hpv,VaxConcerns_1.2,potentially confounding variables were addressed in the most recent HPV vaccine trials
115,gpt-4-0613,hpv,VaxConcerns_1.2,the HPV vaccine research did not involve a comprehensive literature review - a sign of poor research quality
116,gpt-4-0613,mmr,VaxConcerns_1.2,"the study on the MMR vaccine didn't have a large enough sample size, making me question its legitimacy"
117,gpt-4-0613,mmr,VaxConcerns_1.2,"the recent MMR research, the methodology appeared faulty and lacks transparency"
118,gpt-4-0613,mmr,VaxConcerns_1.2,"the chosen indicators in the MMR study could be biased, thus affecting its conclusion"
119,gpt-4-0613,mmr,VaxConcerns_1.2,the quality of control groups in some MMR vaccination tests seems inadequate
120,gpt-4-0613,mmr,VaxConcerns_1.2,the researchers did not allot enough time for potential side effects to manifest in the MMR vaccination study
121,gpt-4-0613,mmr,VaxConcerns_1.2,many MMR vaccine studies lack sufficient diversity in their test population
122,gpt-4-0613,mmr,VaxConcerns_1.2,"the MMR vaccine after reading a study that didn't use placebo controls, rendering the results questionable"
123,gpt-4-0613,mmr,VaxConcerns_1.2,"some of the MMR vaccine researchers are applying inappropriate statistical techniques, making the results unreliable"
124,gpt-4-0613,mmr,VaxConcerns_1.2,the validity of one of the MMR vaccine studies ignores other potential confounding factors
125,gpt-4-0613,mmr,VaxConcerns_1.2,"the published MMR vaccine research, it appears not to follow the norms of scientific rigor that are crucial for trust and accuracy"
126,gpt-4-0613,influenza,VaxConcerns_1.2,the sample size in the most recent influenza vaccine study was far too small to produce credible results
127,gpt-4-0613,influenza,VaxConcerns_1.2,"the research behind influenza vaccines is poorly controlled, with variable standards of practice across different studies"
128,gpt-4-0613,influenza,VaxConcerns_1.2,many influenza vaccine studies lack the robust peer-review process necessary to ensure their accuracy and reliability
129,gpt-4-0613,influenza,VaxConcerns_1.2,"the experimental design of most influenza vaccine studies has issues, such as not accounting for possible confounding factors"
130,gpt-4-0613,influenza,VaxConcerns_1.2,the statistical methods used in analyzing data from influenza vaccine trials are not rigorous enough
131,gpt-4-0613,influenza,VaxConcerns_1.2,"the methodology in many studies on the influenza vaccine is flawed, leading to questionable findings"
132,gpt-4-0613,influenza,VaxConcerns_1.2,"the questionable validity of some influenza vaccine research, due to a lack of replicability in their experiments"
133,gpt-4-0613,influenza,VaxConcerns_1.2,the perceived lack of transparency in reporting of the results of many influenza vaccine studies
134,gpt-4-0613,influenza,VaxConcerns_1.2,"many studies on the influenza vaccine suffer from bias, as they are often funded by pharmaceutical companies"
135,gpt-4-0613,influenza,VaxConcerns_1.2,"the data from most influenza vaccine studies are not adequately cleaned before analysis, which might lead to inaccurate results"
136,gpt-4-0613,yellow_fever,VaxConcerns_1.2,"the yellow fever vaccine research was done on a small sample size, thereby casting doubt on its efficacy"
137,gpt-4-0613,yellow_fever,VaxConcerns_1.2,the lack of a control group in the yellow fever vaccine study greatly undermines its results
138,gpt-4-0613,yellow_fever,VaxConcerns_1.2,the research methodologies used in the yellow fever vaccine studies did not adhere to high standards of scientific rigor
139,gpt-4-0613,yellow_fever,VaxConcerns_1.2,the statistical analysis used in the yellow fever vaccine research was too simplistic and could compromise the results
140,gpt-4-0613,yellow_fever,VaxConcerns_1.2,"the research on the yellow fever vaccine seems to have been rushed and not peer-reviewed, which could lead to misinformation"
141,gpt-4-0613,yellow_fever,VaxConcerns_1.2,the research on the yellow fever vaccine was conducted by individuals who could potentially profit from its production
142,gpt-4-0613,yellow_fever,VaxConcerns_1.2,"due to possible bias in the yellow fever vaccine study, the results could be skewed"
143,gpt-4-0613,yellow_fever,VaxConcerns_1.2,"the researchers on the yellow fever vaccine didn’t account for all relevant variables, which weakens the validity of their findings"
144,gpt-4-0613,yellow_fever,VaxConcerns_1.2,the datasets used in the yellow fever vaccine study were outdated and do not accurately reflect current conditions
145,gpt-4-0613,yellow_fever,VaxConcerns_1.2,"the yellow fever vaccine research did not adequately factor in the potential side-effects in the subject group, which could lead to severe health issues later on"
146,gpt-4-0613,unspecified,VaxConcerns_1.3,"every scientific study on vaccines has a margin of error, which means we can never really be 100 percent sure"
147,gpt-4-0613,unspecified,VaxConcerns_1.3,"just because research shows vaccines are safe, doesn't mean there are no exceptions"
148,gpt-4-0613,unspecified,VaxConcerns_1.3,"after all, science can also make mistakes"
149,gpt-4-0613,unspecified,VaxConcerns_1.3,"the premise of scientific research itself acknowledges room for errors, so how can I trust vaccine research fully?"
150,gpt-4-0613,unspecified,VaxConcerns_1.3,we need to remember that even vaccine research can have false positives and negatives that might distort the truth
151,gpt-4-0613,unspecified,VaxConcerns_1.3,the inherent unpredictability in scientific research. How can we be completely confident about the safety and efficacy of vaccines?
152,gpt-4-0613,unspecified,VaxConcerns_1.3,"evidence surrounding vaccines should be foolproof, but science often admits that research can never provide absolute certainty"
153,gpt-4-0613,unspecified,VaxConcerns_1.3,"just because the majority of research supports vaccine safety, it doesn't mean that there aren't still uncertainties"
154,gpt-4-0613,unspecified,VaxConcerns_1.3,even seemingly definitive research findings may later be contradicted
155,gpt-4-0613,unspecified,VaxConcerns_1.3,experts say science is never fully sure; how can I place blind faith in vaccine research?
156,gpt-4-0613,covid19,VaxConcerns_1.3,the COVID-19 vaccine was rolled out too quickly; how can we be certain it's completely safe?
157,gpt-4-0613,covid19,VaxConcerns_1.3,"the research behind the vaccine might be flawed, nothing is ever 100% in science"
158,gpt-4-0613,covid19,VaxConcerns_1.3,"there are still a lot of unanswered questions about COVID-19 itself, how can we trust a vaccine developed in such a short time?"
159,gpt-4-0613,covid19,VaxConcerns_1.3,"in the past, scientific research has been wrong--what if that's the case for the COVID-19 vaccine?"
160,gpt-4-0613,covid19,VaxConcerns_1.3,"we can never be completely confident in scientific conclusions, especially with a newer disease like COVID-19"
161,gpt-4-0613,covid19,VaxConcerns_1.3,scientists are rushing the research process and we may end up with a vaccine that's less effective or comes with unexpected side effects
162,gpt-4-0613,covid19,VaxConcerns_1.3,"no matter how many studies are conducted, there will always be an element of uncertainty with the COVID-19 vaccine"
163,gpt-4-0613,covid19,VaxConcerns_1.3,"even with research, the science behind the COVID-19 vaccine is fallible and we should be cautious"
164,gpt-4-0613,covid19,VaxConcerns_1.3,the COVID-19 vaccine could be questionable based on their understanding that science is never infallible and sometimes changes its conclusions
165,gpt-4-0613,covid19,VaxConcerns_1.3,"the reliability of a vaccine created in record time, especially considering no study is ever completely foolproof"
166,gpt-4-0613,hpv,VaxConcerns_1.3,the research conducted on the HPV vaccine is totally irrefutable as there's always uncertainty in scientific studies
167,gpt-4-0613,hpv,VaxConcerns_1.3,the HPV vaccine given the fallibility of science and our inability to reach absolute certainty in research conclusions
168,gpt-4-0613,hpv,VaxConcerns_1.3,"they cannot trust the HPV vaccine because science continually evolves, what we know now may not hold true tomorrow"
169,gpt-4-0613,hpv,VaxConcerns_1.3,some doctors are blindly pushing HPV vaccines without considering the idea that no research is completely flawless
170,gpt-4-0613,hpv,VaxConcerns_1.3,"due to the inherent fallibility of scientific research, no research can provide 100% assurance"
171,gpt-4-0613,hpv,VaxConcerns_1.3,the HPV vaccine is just another example of science potentially getting it wrong– how can we put all our faith in it?
172,gpt-4-0613,hpv,VaxConcerns_1.3,no amount of experiments can ever guarantee entirely accurate results
173,gpt-4-0613,hpv,VaxConcerns_1.3,all the instances where scientific research has later been disproved or updated
174,gpt-4-0613,hpv,VaxConcerns_1.3,"the confidence in the HPV vaccine might be misplaced considering that no research, regardless of how thorough, could be definitively faultless"
175,gpt-4-0613,hpv,VaxConcerns_1.3,"science, despite its best efforts, still cannot promise complete surety in its findings"
176,gpt-4-0613,mmr,VaxConcerns_1.3,"the scientific research surrounding the MMR vaccine is truly infallible; after all, nothing can be 100% accurate"
177,gpt-4-0613,mmr,VaxConcerns_1.3,"there might still be data gaps in the MMR vaccine studies, given that scientific studies are never 100% immune to errors"
178,gpt-4-0613,mmr,VaxConcerns_1.3,"the research around the MMR vaccine needs to be revisited; despite studies supporting its effectiveness, there is no perfect science"
179,gpt-4-0613,mmr,VaxConcerns_1.3,science cannot affirm with full confidence every aspect of the MMR vaccine due to possible methodological flaws in the research
180,gpt-4-0613,mmr,VaxConcerns_1.3,the MMR vaccine research is potent but isn't it true that no results are guaranteed in science?
181,gpt-4-0613,mmr,VaxConcerns_1.3,"the conclusions drawn from the MMR vaccine studies are not the final word, as room for error in scientific research is always present"
182,gpt-4-0613,mmr,VaxConcerns_1.3,"while most research supports the MMR vaccine, one must be mindful of scientific fallibility and maintain a level of skepticism"
183,gpt-4-0613,mmr,VaxConcerns_1.3,all MMR vaccine studies are flawless; isn't in the nature of science to continuously question and reassess current knowledge?
184,gpt-4-0613,mmr,VaxConcerns_1.3,accepting the MMR vaccine research findings unquestioningly knowing that no scientific study can be entirely free of mistakes
