concern_id,source,vaccine_type,class,statement
718,gpt-4-0613,mmr,VaxConcerns_3.4,the needle used for the MMR vaccine can cause health problems if it's not sterilized properly
719,gpt-4-0613,mmr,VaxConcerns_3.4,"the way the MMR vaccine is administered might cause potential harm, especially if hygiene practices aren't strictly followed"
720,gpt-4-0613,mmr,VaxConcerns_3.4,"the possibility that the MMR vaccine may become contaminated, making it unsafe, if not stored at the appropriate temperature"
721,gpt-4-0613,mmr,VaxConcerns_3.4,that the practices surrounding the delivery of the MMR vaccine in developing countries might increase health risks
722,gpt-4-0613,mmr,VaxConcerns_3.4,"the vaccination practices, more than the vaccine itself, are responsible for the health risks associated with the MMR vaccine"
723,gpt-4-0613,mmr,VaxConcerns_3.4,the environment in which the MMR vaccination is administered can result in certain health risks
724,gpt-4-0613,mmr,VaxConcerns_3.4,whether the MMR vaccine might become less safe if not used within its proper expiration date
725,gpt-4-0613,mmr,VaxConcerns_3.4,the danger with MMR vaccines may lie in inappropriate handling and delivery rather than the vaccine contents
726,gpt-4-0613,influenza,VaxConcerns_3.4,the flu shot injection process might pose a health risk because of the possibility of needle contamination
727,gpt-4-0613,influenza,VaxConcerns_3.4,"health risks might be caused by the vaccine's delivery method, like dirty needles, rather than the flu vaccine itself"
728,gpt-4-0613,influenza,VaxConcerns_3.4,there is a chance of infection fro unsanitary vaccine delivery when getting the influenza shot
729,gpt-4-0613,influenza,VaxConcerns_3.4,that the process of administering the flu vaccine might put me at risk of contracting other diseases
730,gpt-4-0613,influenza,VaxConcerns_3.4,vaccine delivery practices might cause health risks rather than the influenza vaccine itself
731,gpt-4-0613,influenza,VaxConcerns_3.4,"if not administered properly, the method of delivering the influenza vaccine may lead to complications"
732,gpt-4-0613,influenza,VaxConcerns_3.4,"health risks could come from how the flu shot is administered, rather just than what's in the vaccine"
733,gpt-4-0613,influenza,VaxConcerns_3.4,"the conditions surrounding the injection of the influenza vaccine, believing this might lead to unforeseen health risks"
734,gpt-4-0613,influenza,VaxConcerns_3.4,"if the delivery of the flu shot is not thoroughly sterilized, it could lead to other health problems"
735,gpt-4-0613,influenza,VaxConcerns_3.4,"the practices around giving the flu vaccine, like using the same vial for multiple people, might be where the real dangers lie rather than the vaccine itself"
736,gpt-4-0613,yellow_fever,VaxConcerns_3.4,the method used to administer the Yellow fever vaccine may be causing more harm than good
737,gpt-4-0613,yellow_fever,VaxConcerns_3.4,he injecting needles used can potentially lead to infection or disease transmission
738,gpt-4-0613,yellow_fever,VaxConcerns_3.4,"he environment wherein I was vaccinated for Yellow Fever was unclean, leading to potential risk of infection"
739,gpt-4-0613,yellow_fever,VaxConcerns_3.4,the hygiene standards of the clinic where I received my Yellow Fever vaccine weren't up to par
740,gpt-4-0613,yellow_fever,VaxConcerns_3.4,the clinic's poor storage conditions might reduce the effectiveness of the Yellow fever vaccine
741,gpt-4-0613,yellow_fever,VaxConcerns_3.4,the lack of properly trained healthcare workers administering the Yellow Fever vaccine could lead to errors
742,gpt-4-0613,yellow_fever,VaxConcerns_3.4,the rushed administration of vaccines in emergency health situations could potentially magnify risks
743,gpt-4-0613,yellow_fever,VaxConcerns_3.4,the procedures taken during the Yellow Fever vaccine distribution may increase the risk of vaccine contamination
744,gpt-4-0613,yellow_fever,VaxConcerns_3.4,the improper handling of the Yellow Fever vaccine at the local clinic could compromise its safety
745,gpt-4-0613,yellow_fever,VaxConcerns_3.4,"the healthcare professionals may not have followed the proper protocol while delivering the Yellow fever vaccine, thereby posing health risks"
746,gpt-4-0613,unspecified,VaxConcerns_3.5,my previous allergic reactions might make me a high-risk individual for vaccine side effects
747,gpt-4-0613,unspecified,VaxConcerns_3.5,"my elderly father, with his weak immunity, may experience severe health risks from vaccines"
748,gpt-4-0613,unspecified,VaxConcerns_3.5,"as a cancer patient undergoing radiation therapy, the vaccine might pose a higher health risk to me"
749,gpt-4-0613,unspecified,VaxConcerns_3.5,my chronic disease increases my risk of having an adverse reaction to the vaccine
750,gpt-4-0613,unspecified,VaxConcerns_3.5,"my daughter, who has a history of severe allergy, could face serious health risks from vaccines"
751,gpt-4-0613,unspecified,VaxConcerns_3.5,"vaccines might pose more significant health risks for my son, who is autistic"
752,gpt-4-0613,unspecified,VaxConcerns_3.5,"being a diabetic, the vaccine could heighten health risks for me"
753,gpt-4-0613,unspecified,VaxConcerns_3.5,that my pregnant wife might be at a higher risk of experiencing negative effects due to vaccines
754,gpt-4-0613,unspecified,VaxConcerns_3.5,"my autoimmune condition may make me a high-risk individual for vaccines, exacerbating the health risks"
755,gpt-4-0613,unspecified,VaxConcerns_3.5,people like me with a weakened immune system could face more severe health risks from vaccines
756,gpt-4-0613,covid19,VaxConcerns_3.5,my existing health condition will put me at a higher risk of severe side effects from the COVID-19 vaccine
757,gpt-4-0613,covid19,VaxConcerns_3.5,"as a cancer patient, the COVID-19 vaccination may be riskier for me compared to a healthy individual"
758,gpt-4-0613,covid19,VaxConcerns_3.5,the elderly might face health risks from the COVID-19 vaccine due to their naturally weaker immune systems
759,gpt-4-0613,covid19,VaxConcerns_3.5,"my daughter, who has a rare autoimmune condition, might face serious side effects from the COVID-19 vaccine"
760,gpt-4-0613,covid19,VaxConcerns_3.5,my son's autism might make him more susceptible to severe reactions from the COVID-19 vaccine
761,gpt-4-0613,covid19,VaxConcerns_3.5,"as a diabetic, receiving the COVID-19 vaccine could potentially be risky for my health"
762,gpt-4-0613,covid19,VaxConcerns_3.5,individuals with heart conditions may have a higher risk when receiving the COVID-19 vaccine
763,gpt-4-0613,covid19,VaxConcerns_3.5,"people battling lung diseases, like pneumonia or COPD, could have adverse reactions to the COVID-19 vaccine"
764,gpt-4-0613,covid19,VaxConcerns_3.5,my pre-existing kidney disease puts me at a higher risk for complications with the COVID-19 vaccine
765,gpt-4-0613,covid19,VaxConcerns_3.5,"those suffering from multiple sclerosis, might be exposed to higher risks if he receives the COVID-19 vaccine"
766,gpt-4-0613,hpv,VaxConcerns_3.5,"my daughter, who has an autoimmune disease, might experience severe side effects from the HPV vaccine"
767,gpt-4-0613,hpv,VaxConcerns_3.5,"individuals with compromised immune systems, like my son, face higher risks when they receive the HPV vaccine"
768,gpt-4-0613,hpv,VaxConcerns_3.5,"for elders who are prone to weak immunity, the HPV vaccine could present additional health risks"
769,gpt-4-0613,hpv,VaxConcerns_3.5,my current health condition might make me more susceptible to negative reactions from the HPV vaccine
770,gpt-4-0613,hpv,VaxConcerns_3.5,people with certain medical conditions might not respond well to the HPV vaccine. I fear that my existing heart condition might put me in that category
771,gpt-4-0613,hpv,VaxConcerns_3.5,my ongoing treatment for cancer might interact negatively with the HPV vaccine
772,gpt-4-0613,hpv,VaxConcerns_3.5,people like me who have suffered adverse vaccine reactions in the past could have a higher risk when it comes to the HPV vaccine
773,gpt-4-0613,hpv,VaxConcerns_3.5,"with my daughter's multiple food and medication allergies, I'm concerned about her risk of an adverse reaction to the HPV vaccine"
774,gpt-4-0613,hpv,VaxConcerns_3.5,"as someone with a genetic predisposition to autoimmune disorders, I believe I may be at a higher risk of adverse reactions to the HPV vaccine"
775,gpt-4-0613,hpv,VaxConcerns_3.5,"given my son's previous history of severe allergic reactions, I fear that the HPV vaccine might pose a significant risk to him"
776,gpt-4-0613,mmr,VaxConcerns_3.5,people with certain health conditions may react adversely to the MMR vaccine
777,gpt-4-0613,mmr,VaxConcerns_3.5,"that majority fail to comprehend the potential health risks some high-risk individuals may face with the Measles, Mumps, Rubella vaccine"
778,gpt-4-0613,mmr,VaxConcerns_3.5,the severity of reactions to the MMR vaccine can vary significantly in high-risk individuals and this worries me
779,gpt-4-0613,mmr,VaxConcerns_3.5,"my son, being immunocompromised, may face serious health risks if he gets the MMR vaccine"
780,gpt-4-0613,mmr,VaxConcerns_3.5,"people with existing health issues could be at higher risk of adverse reactions to the MMR vaccine, this really concerns me"
781,gpt-4-0613,mmr,VaxConcerns_3.5,our healthcare providers should spend more time discussing the possible adverse reactions to MMR vaccines for those with certain pre-existing conditions
782,gpt-4-0613,mmr,VaxConcerns_3.5,"my daughter, who is living with an autoimmune disorder, might be at high risk for adverse reactions to the MMR vaccine"
783,gpt-4-0613,mmr,VaxConcerns_3.5,some reactions can be life-threatening to high-risk individuals
784,gpt-4-0613,mmr,VaxConcerns_3.5,those with chronic illnesses who may not respond well to the MMR vaccine due to their existing conditions
785,gpt-4-0613,mmr,VaxConcerns_3.5,"we should have more open conversations about how people with certain demographics or health conditions may be at higher risk for adverse reactions from vaccines, like MMR"
786,gpt-4-0613,influenza,VaxConcerns_3.5,influenza vaccines pose a direct health risk to those already dealing with suppressed immunity issues
787,gpt-4-0613,influenza,VaxConcerns_3.5,individuals with certain pre-existing health conditions may face serious side effects from flu vaccines
788,gpt-4-0613,influenza,VaxConcerns_3.5,that elderly individuals may be at higher risk of adverse reactions to the influenza vaccine
789,gpt-4-0613,influenza,VaxConcerns_3.5,kids with severe allergies possibly stand a higher chance of experiencing a harmful reaction from influenza vaccines
790,gpt-4-0613,influenza,VaxConcerns_3.5,"people who are immunocompromised can react negatively to the flu vaccine, putting their health in further jeopardy"
791,gpt-4-0613,influenza,VaxConcerns_3.5,pregnant women may be putting their babies at risk by getting the flu vaccine
792,gpt-4-0613,influenza,VaxConcerns_3.5,"those with chronic illnesses, like heart or lung disease, may be more at risk when receiving the influenza vaccine"
793,gpt-4-0613,influenza,VaxConcerns_3.5,the perception that those suffering from autoimmune diseases are particularly vulnerable to the risks presented by flu vaccines
794,gpt-4-0613,influenza,VaxConcerns_3.5,"hose under certain medications may have shifted immunological responses to the influenza vaccine, causing unforeseen health hazards"
795,gpt-4-0613,influenza,VaxConcerns_3.5,individuals with a history of Guillain-Barre Syndrome may deal with severe consequences if they receive the flu vaccine
796,gpt-4-0613,yellow_fever,VaxConcerns_3.5,people who are immunocompromised might experience severe side effects from the Yellow Fever vaccine
797,gpt-4-0613,yellow_fever,VaxConcerns_3.5,"my grandmother, because of her advanced age and delicate health, could experience adverse reactions to the Yellow Fever vaccine"
798,gpt-4-0613,yellow_fever,VaxConcerns_3.5,pre-existing conditions might make you a high-risk individual for the Yellow Fever vaccine
799,gpt-4-0613,yellow_fever,VaxConcerns_3.5,people with autoimmune diseases could face potential health risks from the Yellow Fever vaccine
800,gpt-4-0613,yellow_fever,VaxConcerns_3.5,pregnant women might be at higher risk for complications due to the Yellow Fever vaccine
801,gpt-4-0613,yellow_fever,VaxConcerns_3.5,certain demographics may not respond well to the Yellow Fever vaccine
802,gpt-4-0613,yellow_fever,VaxConcerns_3.5,my heart disease might make me more sensitive to the side effects of the Yellow Fever vaccine
803,gpt-4-0613,yellow_fever,VaxConcerns_3.5,individuals suffering from HIV/AIDS are discouraged from taking the Yellow Fever vaccine due to potential health risks
804,gpt-4-0613,yellow_fever,VaxConcerns_3.5,"individuals with suppressed immune systems, like my son who has undergone chemotherapy, could be more susceptible to health risks from the Yellow Fever vaccine"
805,gpt-4-0613,yellow_fever,VaxConcerns_3.5,"individuals who are allergic to eggs might have adverse reactions to the Yellow Fever vaccine, and I'm not sure if I should get it as I have a known egg allergy"
806,gpt-4-0613,unspecified,VaxConcerns_4.1,"my religious principles, which hold the body as a sacred temple, are in direct conflict with injecting foreign substances through vaccination"
807,gpt-4-0613,unspecified,VaxConcerns_4.1,the concept of vaccination violates my faith's teaching about maintaining natural purity of the body
808,gpt-4-0613,unspecified,VaxConcerns_4.1,the injunctions of my religion against 'pollution' or 'contamination' make it hard for me to agree to vaccination
809,gpt-4-0613,unspecified,VaxConcerns_4.1,certain vaccines derived from fetal cell lines are incompatible with my adamant pro-life position
810,gpt-4-0613,unspecified,VaxConcerns_4.1,getting a vaccine would go against the teachings of my spiritual leader who advocates self-healing
811,gpt-4-0613,unspecified,VaxConcerns_4.1,taking vaccines signifies a lack of faith in the healing power that my religion believes in
812,gpt-4-0613,unspecified,VaxConcerns_4.1,the practice of vaccination contradicts my theological doctrine that discourages any form of bodily intrusion
813,gpt-4-0613,unspecified,VaxConcerns_4.1,my ethical belief in the immutability of the human body may clash with the culture of preventive vaccination
814,gpt-4-0613,unspecified,VaxConcerns_4.1,"my devotion to a natural lifestyle, grounded in my religious beliefs, could stand in contradiction to getting vaccinated"
815,gpt-4-0613,unspecified,VaxConcerns_4.1,allowing my child to be vaccinated could be seen as compromising our family's deeply held religious convictions about bodily purity
816,gpt-4-0613,covid19,VaxConcerns_4.1,the COVID-19 vaccine was developed without considering my deeply held religious convictions
817,gpt-4-0613,covid19,VaxConcerns_4.1,accepting the COVID-19 vaccine goes against my personal ethical standards
818,gpt-4-0613,covid19,VaxConcerns_4.1,my religious beliefs are not taken into account when authorities mandate COVID-19 vaccination
819,gpt-4-0613,covid19,VaxConcerns_4.1,COVID-19 vaccination policies do not respect my constitutionally guaranteed religious freedom
820,gpt-4-0613,covid19,VaxConcerns_4.1,my moral objections to the COVID-19 vaccine are often overlooked in the debate
821,gpt-4-0613,covid19,VaxConcerns_4.1,the rush to vaccinate everyone against COVID-19 may marginalize those of us with religious objections
822,gpt-4-0613,covid19,VaxConcerns_4.1,the mandate for a COVID-19 vaccine disregards my ethical principles
823,gpt-4-0613,covid19,VaxConcerns_4.1,personal convictions and religion are being ignored in the push to vaccinate everyone against COVID-19
824,gpt-4-0613,covid19,VaxConcerns_4.1,my religious beliefs aren't being respected in the discussion around COVID-19 vaccinations
825,gpt-4-0613,covid19,VaxConcerns_4.1,my moral stance against the COVID-19 vaccine is frequently ignored
826,gpt-4-0613,hpv,VaxConcerns_4.1,"the HPV vaccine goes against my religious beliefs, as my faith encourages natural healing"
827,gpt-4-0613,hpv,VaxConcerns_4.1,"getting vaccinated, especially for HPV, infringes upon my rights to practice my religion freely"
828,gpt-4-0613,hpv,VaxConcerns_4.1,it's morally wrong to force someone to get the HPV vaccine even when their religious teachings may be against it
829,gpt-4-0613,hpv,VaxConcerns_4.1,"my ethical standpoints, based on my religious beliefs, might not support the administration of the HPV vaccine"
830,gpt-4-0613,hpv,VaxConcerns_4.1,"my body should be kept pure and free of foreign substances, as my religion suggests, and this includes the HPV vaccine"
831,gpt-4-0613,hpv,VaxConcerns_4.1,it is unjust to disregard individual rights and religious beliefs when it comes to obligatory HPV vaccination
832,gpt-4-0613,hpv,VaxConcerns_4.1,"receiving the HPV vaccine may conflict with my religious doctrine, which values natural immunity"
833,gpt-4-0613,hpv,VaxConcerns_4.1,it against my personal and religious ethics to receive the HPV vaccine; my faith teaches me to trust in God's immune system
834,gpt-4-0613,hpv,VaxConcerns_4.1,compulsory HPV vaccination infringes upon freedoms granted by religion and individual ethics
835,gpt-4-0613,hpv,VaxConcerns_4.1,my rights to religious freedom are not being considered when it comes to the HPV vaccine which contravenes my moral convictions
836,gpt-4-0613,mmr,VaxConcerns_4.1,the MMR vaccine mandate is trampling on my religious rights
837,gpt-4-0613,mmr,VaxConcerns_4.1,"the government is neglecting my beliefs and ethics by pushing for compulsory measles, mumps, and rubella vaccination"
838,gpt-4-0613,mmr,VaxConcerns_4.1,my religious views should be considered when deciding whether to get vaccinated for MMR
839,gpt-4-0613,mmr,VaxConcerns_4.1,society doesn't respect personal religious beliefs when it comes to the issue of MMR vaccination
840,gpt-4-0613,mmr,VaxConcerns_4.1,my moral beliefs are being disregarded when people emphasize too much on the need for vaccination against MMR
841,gpt-4-0613,mmr,VaxConcerns_4.1,"requiring immunizations, such as the MMR vaccine, compromises my religious freedom"
842,gpt-4-0613,mmr,VaxConcerns_4.1,my ethical beliefs are being violated by forcing families to get their children the MMR vaccine
843,gpt-4-0613,mmr,VaxConcerns_4.1,the fact that my religious views are seen as secondary to public health concerns when it comes to the MMR vaccine
844,gpt-4-0613,mmr,VaxConcerns_4.1,it's fundamental to respect the religious ethics of each individual before imposing a universal vaccination policy
845,gpt-4-0613,mmr,VaxConcerns_4.1,"vaccination should always be a personal decision, especially when religious beliefs and MMR vaccination seem to conflict"
846,gpt-4-0613,influenza,VaxConcerns_4.1,getting the flu vaccine could violate the ethical principles I hold dear in my personal belief system
847,gpt-4-0613,influenza,VaxConcerns_4.1,my religious commitment forbids me from receiving vaccines such as the influenza shot
848,gpt-4-0613,influenza,VaxConcerns_4.1,succumbing to vaccination can potentially contradict my moral standpoint
849,gpt-4-0613,influenza,VaxConcerns_4.1,my religious liberties are threatened by compulsory flu vaccinations
850,gpt-4-0613,influenza,VaxConcerns_4.1,"getting a flu shot might clash with my spiritual morals, as I hold integrity to my religion rooted deep"
851,gpt-4-0613,influenza,VaxConcerns_4.1,coercing me into getting vaccinated undermines my individual rights to exercise my personal and moral beliefs
852,gpt-4-0613,influenza,VaxConcerns_4.1,accepting the influenza vaccine conflicts with my faith's assured principles
853,gpt-4-0613,influenza,VaxConcerns_4.1,"implementing the influenza vaccine may clash with my personal ethics, leading to spiritual quandaries"
854,gpt-4-0613,influenza,VaxConcerns_4.1,receiving a flu shot may be in stark contrast to my religious ideologies
855,gpt-4-0613,influenza,VaxConcerns_4.1,"being vaccinated against the flu does not align with my religious beliefs and moral code, hence causing internal conflict for me"
856,gpt-4-0613,yellow_fever,VaxConcerns_4.1,"taking the Yellow Fever vaccine goes against our religious principles, which is not fair to us who wish to stay true to our faith"
857,gpt-4-0613,yellow_fever,VaxConcerns_4.1,"it's inappropriate to force people to get vaccinated, especially when their religious beliefs conflict with the use of vaccines"
858,gpt-4-0613,yellow_fever,VaxConcerns_4.1,"getting the Yellow Fever vaccine violates my ethical stance on not harming any living beings, noted in my religion"
859,gpt-4-0613,yellow_fever,VaxConcerns_4.1,our philosophical view of life is being undermined by making us take the Yellow Fever vaccine
860,gpt-4-0613,yellow_fever,VaxConcerns_4.1,"by encouraging us to receive the Yellow Fever vaccine, our personal beliefs and values are being pushed aside"
861,gpt-4-0613,yellow_fever,VaxConcerns_4.1,forcing someone to take the Yellow Fever vaccine disregards their personal religious and ethical choices
862,gpt-4-0613,yellow_fever,VaxConcerns_4.1,advocating for the Yellow Fever vaccination is an infringement upon my religious freedom
863,gpt-4-0613,yellow_fever,VaxConcerns_4.1,my faith carries weight in my decision to not get the Yellow Fever vaccine
864,gpt-4-0613,yellow_fever,VaxConcerns_4.1,my moral code isn't aligned with taking the Yellow Fever vaccine - it simply conflicts with my deeply-held beliefs
865,gpt-4-0613,yellow_fever,VaxConcerns_4.1,the push for vaccination is not considering the religious ramifications
866,gpt-4-0613,unspecified,VaxConcerns_4.2,"the government forcing me to get a vaccine tramples on my rights as a citizen, depriving me of my freedom to choose what goes into my body"
867,gpt-4-0613,unspecified,VaxConcerns_4.2,being denied entry into certain places because I am not vaccinated infringes on my human right to freedom of movement
868,gpt-4-0613,unspecified,VaxConcerns_4.2,forcing people to get vaccinated is a blatant disregard of our individual rights to personal autonomy
869,gpt-4-0613,unspecified,VaxConcerns_4.2,the right to make decisions about one's own health is being completely ignored with these vaccine mandates
870,gpt-4-0613,unspecified,VaxConcerns_4.2,the penalties imposed on those who choose not to get vaccinated an assault on our personal liberty
871,gpt-4-0613,unspecified,VaxConcerns_4.2,compulsory vaccination policies as an encroachment on my inherent human rights
872,gpt-4-0613,unspecified,VaxConcerns_4.2,the push for mass vaccination infringes on our right to choose what's best for ourselves and our bodies
873,gpt-4-0613,unspecified,VaxConcerns_4.2,mandatory vaccination schemes are steadily eroding our personal freedoms and autonomy
874,gpt-4-0613,unspecified,VaxConcerns_4.2,the potential consequences for not getting vaccinated can be interpreted as a direct assault on my personal decision-making autonomy
875,gpt-4-0613,unspecified,VaxConcerns_4.2,"my refusal to vaccinate is an exercise of my human right to personal autonomy, and penalties put in place by authorities intrude on this right"
876,gpt-4-0613,covid19,VaxConcerns_4.2,forcing people to get vaccinated is stealing their autonomy and right to choose
877,gpt-4-0613,covid19,VaxConcerns_4.2,demanding mandatory COVID-19 vaccinations is an encroachment on our individual rights
878,gpt-4-0613,covid19,VaxConcerns_4.2,governments compel us to have the COVID-19 vaccine
879,gpt-4-0613,covid19,VaxConcerns_4.2,the right to health autonomy is endangered when people are pressured to get the COVID-19 vaccine
880,gpt-4-0613,covid19,VaxConcerns_4.2,people's right to autonomy is disregarded when they're forced to vaccinate against COVID-19
881,gpt-4-0613,covid19,VaxConcerns_4.2,our basic human rights are being overlooked when enforcing such strict vaccination mandates
882,gpt-4-0613,covid19,VaxConcerns_4.2,there's a heightened disregard for our cherished individual rights when COVID-19 vaccinations are imposed upon us
883,gpt-4-0613,covid19,VaxConcerns_4.2,our right to decide concerning our own bodies is being threatened by relentless vaccine mandates
884,gpt-4-0613,covid19,VaxConcerns_4.2,it's unjust to ignore our autonomy when implementing consequences for not accepting the COVID-19 vaccine
885,gpt-4-0613,covid19,VaxConcerns_4.2,it's distressing how our fundamental human right to choose is being undermined by forced vaccinations
886,gpt-4-0613,hpv,VaxConcerns_4.2,mandatory HPV vaccination infringes on my personal freedom to make health decisions
887,gpt-4-0613,hpv,VaxConcerns_4.2,"the HPV vaccine mandate is a negative force geopolitically, as it restricts our autonomy and right to choose for ourselves"
888,gpt-4-0613,hpv,VaxConcerns_4.2,"compulsory HPV vaccines is highly troublesome, infringing on our intrinsic human right to determine what goes into our bodies"
889,gpt-4-0613,hpv,VaxConcerns_4.2,the authorities imposing the HPV vaccine on us are dictatorial and an infringement of our basic rights
890,gpt-4-0613,hpv,VaxConcerns_4.2,any law demanding HPV vaccination is essentially stripping away my sovereignty
891,gpt-4-0613,hpv,VaxConcerns_4.2,"the fact that my children are being coerced into receiving the HPV vaccine, as I believe it disregards my parental rights to decide on their healthcare"
892,gpt-4-0613,hpv,VaxConcerns_4.2,"mandatory HPV vaccinations are a breach of our right to autonomy, allowing government to overstep and control our medical decisions"
893,gpt-4-0613,hpv,VaxConcerns_4.2,"it should be up to me to decide on the risk-benefit ratio of the HPV vaccine, without facing sanctions for my choice"
894,gpt-4-0613,hpv,VaxConcerns_4.2,"mandating the HPV vaccine, as it seems to fundamentally disregard my right to make choices about my body"
